Headline,Source,Posted,Description,Link
How to watch de Minaur vs. Medvedev in the 2024 French Open online for free,Mashable,16 hours ago,Access these free streaming platforms from anywhere in the world with ExpressVPN. It's the fourth...,https://mashable.com/article/de-minaur-medvedev-french-open-live-stream-for-free
How to watch Navarro vs. Sabalenka in the 2024 French Open online for free,Mashable,16 hours ago,Access these free streaming platforms from anywhere in the world with ExpressVPN. The quarter finals...,https://mashable.com/article/navarro-sabalenka-french-open-live-stream-for-free
How to watch Djokovic vs. Cerundolo in the 2024 French Open online for free,Mashable,16 hours ago,Access these free streaming platforms from anywhere in the world with ExpressVPN. Novak Djokovic is...,https://mashable.com/article/djokovic-cerundolo-french-open-live-stream-for-free
2 No-Brainer Dividend Stocks You Can Buy With $100 in June | The Motley Fool,The Motley Fool,16 hours ago,Searching for investments that can outperform the benchmark S&P 500 index often gets wickedly...,https://www.fool.com/investing/2024/06/03/2-no-brainer-dividend-stocks-you-can-buy-with-100/
Apple Stock Investors Have Reason to Cheer as iPhone Sales Jump,The Motley Fool via AOL,5 days ago,"Fool.com contributor Parkev Tatevosian discusses what the news could mean for Apple (NASDAQ: AAPL) stock investors. *Stock prices used were the afternoon prices of May 27, 2024. The video was ...",https://www.aol.com/apple-stock-investors-reason-cheer-093000110.html
New iOS 18 rumors predict the 5 most useful AI features that could hit your iPhone soon,TechRadar,4 days ago,"Here we've listed five of the most recent tidbits that we've heard from various sources, and ranked...",https://www.techradar.com/phones/iphone/new-ios-18-rumors-predict-the-5-most-useful-ai-features-that-could-hit-your-iphone-soon
"VEGER X5 WalletTrack power bank review - combines a MagSafe wallet, power bank, and a tracker - The...",The Gadgeteer,4 days ago,"If you have an iPhone with MagSafe, the VEGER X5 WalletTrack power bank, which is currently seeking...",https://the-gadgeteer.com/2024/05/31/veger-x5-wallettrack-power-bank-review-combines-a-magsafe-wallet-power-bank-and-a-tracker/
Man shot while in courtyard between buildings on Pittsburgh’s North Shore,WPXI via Yahoo News,2 days ago,Lebanon Police respond to incident involving barricaded person 6-week-old boy dies after attacked by...,https://www.yahoo.com/news/man-shot-while-courtyard-between-121244172.html?fr=sycsrp_catchall
Apple's rigorous water resistance tests for iPhones recorded live,Android Headlines,4 days ago,"The best Android flagships and iPhones boast an IP68 rating, ensuring the best protection against...",https://www.androidheadlines.com/2024/05/apple-rigorous-water-resistance-tests-iphones-recorded-live.html
Text effects coming to Messages in iOS 18 might be able to format individual words,PhoneArena,3 days ago,"You know how, when you text another iPhone user the word ""Congratulations,"" both you and the...",https://www.phonearena.com/news/text-effects-coming-to-the-messages-app-in-ios-18_id158947
"Emoji Meanings Explained (Wait, That's What the Eggplant Emoji Means?!)",CNET,17 hours ago,"Over time, emoji meanings have become subjective depending on a message's context and wider cultural...",https://www.cnet.com/tech/services-and-software/emoji-meanings-explained-wait-thats-what-the-eggplant-emoji-means/
Apple Stock Outlook: The Calm Before the AI Storm at WWDC 2024,InvestorPlace,17 hours ago,Apple (NASDAQ:AAPL) starts its Worldwide Developer Conference on June 10. Investors should expect...,https://investorplace.com/2024/06/apple-stock-outlook-the-calm-before-the-ai-storm-at-wwdc-2024/
Apple stock gains as new data shows an iPhone sales rebound in China By Investing.com,Investing.com,7 days ago,Apple's (NASDAQ:AAPL) smartphone shipments in China surged by 52% in April compared to the previous...,https://www.investing.com/news/stock-market-news/apples-iphone-sales-in-april-jump-52--reuters-432SI-3458336
"Some fog develops overnight, cloudy start to Monday",WPXI via Yahoo News,2 days ago,"Lebanon Police respond to incident involving barricaded person 6-week-old boy dies after attacked by family dog, parents say NSA says iPhone and Android...",https://www.yahoo.com/news/off-rain-falls-early-sunday-113604450.html?fr=sycsrp_catchall
"A physicist dismantles Terrence Howard's nonsensical ""theory of everything""",Boing Boing,17 hours ago,"Terrence Howard recently appeared on the Joe Rogan podcast. Sabine Hossenfelder, a theoretical...",https://boingboing.net/2024/06/03/a-physicist-dismantles-terrence-howards-nonsensical-theory-of-everything.html
Doly lets you generate 3D product videos from your iPhone,TechCrunch via Yahoo Finance,6 days ago,"AniML, the French startup behind a new 3D capture app called Doly, wants to create the Photoroom of...",https://finance.yahoo.com/news/doly-lets-generate-3d-product-130000827.html?fr=sycsrp_catchall
Apple Inc. (NASDAQ:AAPL) Stock Position Trimmed by Cary Street Partners Investment Advisory LLC,ETF DAILY NEWS,21 hours ago,"Cary Street Partners Investment Advisory LLC lowered its holdings in Apple Inc. (NASDAQ:AAPL – Free Report) by 90.1% during the 4th quarter, Holdings Channel reports. Apple makes up about 2.2% ...",https://www.etfdailynews.com/2024/06/03/apple-inc-nasdaqaapl-stock-position-trimmed-by-cary-street-partners-investment-advisory-llc/
Opera Touch Web Browser for iOS,CNET,17 hours ago,"It's a browser so good, it won a Red Dot Award for its user interface design. Search instantly: When you start Opera Touch, the browser is instantly ready to find things on the web. Just start ...",https://download.cnet.com/opera-touch-web-browser/3000-2356_4-77927742.html
Northcape Wealth Management LLC Trims Position in Apple Inc. (NASDAQ:AAPL),ETF DAILY NEWS,21 hours ago,"Apple comprises about 3.3% of Northcape Wealth Management LLC’s investment portfolio, making the stock its 4th biggest position. Several other large investors have also recently made changes ...",https://www.etfdailynews.com/2024/06/03/northcape-wealth-management-llc-trims-position-in-apple-inc-nasdaqaapl/
Kino is a new iPhone app for videographers from the makers of Halide,TechCrunch,5 days ago,"Lux, the startup behind popular pro photography app Halide and others, is venturing into video with its latest app launch. On Wednesday, the company announced Kino, a new video capture app for ...",https://techcrunch.com/2024/05/29/meet-kino-new-iphone-app-for-pro-and-amateur-videographers-from-the-makers-of-halide/
Apple sees rebound in China’s phone market amid discounts | Arkansas Democrat Gazette,Arkansas Democrat-Gazette,6 days ago,Apple Inc.'s iPhone staged a rebound in China last month with shipments rising 52% amid a flurry of...,https://www.arkansasonline.com/news/2024/may/29/apple-sees-rebound-in-chinas-phone-market-amid/
Sonos Ace Headphones vs. AirPods Max,MacRumors,18 hours ago,"The $449 Sonos Ace headphones have some enticing design elements and features you won't see in Apple's headphones, so we thought we'd compare them to the...",https://www.macrumors.com/2024/06/03/sonos-ace-vs-airpods-max/
Apple sees rebound in China’s phone market amid discounts | Northwest Arkansas Democrat-Gazette,Northwest Arkansas Democrat Gazette,6 days ago,Apple Inc.'s iPhone staged a rebound in China last month with shipments rising 52% amid a flurry of...,https://www.nwaonline.com/news/2024/may/29/apple-sees-rebound-in-chinas-phone-market-amid/
"2 people killed, 7 people hurt in Penn Hills shooting, police say",WPXI via Yahoo News,2 days ago,Lebanon Police respond to incident involving barricaded person 6-week-old boy dies after attacked by...,https://www.yahoo.com/news/2-people-killed-7-people-110310544.html?fr=sycsrp_catchall
Certuity LLC Raises Stake in Apple Inc. (NASDAQ:AAPL),ETF DAILY NEWS,21 hours ago,"Certuity LLC raised its stake in shares of Apple Inc. (NASDAQ:AAPL – Free Report) by 15.8% during the 4th quarter, according to the company in its most recent 13F filing with the Securities ...",https://www.etfdailynews.com/2024/06/03/certuity-llc-raises-stake-in-apple-inc-nasdaqaapl/
"2024 UIL State Baseball: How to watch, schedule, scores, how to get tickets",Corpus Christi Caller-Times via Yahoo Sports,1 day ago,How to get tickets Day Ticket: $15 All-Tournament: $40 Coaches All-Tournament: $25 Children Two years and younger: FREE *Coaches...,https://sports.yahoo.com/2024-uil-state-baseball-watch-161551721.html?fr=sycsrp_catchall
This is how Apple water tests its iPhones for IP rating and durability,Neowin,5 days ago,Multiple videos show how Apple water tests its iPhone models to achieve the desired durability and...,https://www.neowin.net/news/this-is-how-apple-water-tests-its-iphones-for-ip-rating-and-durability/
"2024 UIL State Baseball: How to watch, schedule, scores, how to get tickets",Gannett via AOL,1 day ago,How to get tickets Day Ticket: $15 All-Tournament: $40 Coaches All-Tournament: $25 Children Two years and younger: FREE *Coaches...,https://www.aol.com/2024-uil-state-baseball-watch-161551683.html
iPhones will reportedly get AI-generated emojis with iOS 18 this year,Evening Standard via Yahoo News,5 days ago,"With more than 3,700 emojis at our fingertips, do we need more colourful icons to express ourselves?...",https://www.yahoo.com/news/iphones-reportedly-ai-generated-emojis-135958449.html?fr=sycsrp_catchall
"Catch up on the day's stories: AI for the iPhone, reining in peanut allergies, summer movies",Erie News Now Plus,6 days ago,"By Daniel Wine, CNN",http://www.erienewsnow.com/story/50839418/catch-up-on-the-days-stories-ai-for-the-iphone-reining-in-peanut-allergies-summer-movies
"‘Genshin Impact’ Version 4.7 “An Everlasting Dream Intertwined” Update Preload Now Live, Download...",TouchArcade,20 hours ago,"Beginning Wednesday this week, HoYoverse will release Genshin Impact version 4.7 ""An Everlasting Dream Intertwined"" for iOS, Android, PS4, PS5, and PC platforms.",https://toucharcade.com/2024/06/03/genshin-impact-version-4-7-an-everlasting-dream-intertwined-update-preload-now-live-download-size-revealed/
Apple's Plan to Win the Generative AI Race Involves Weird Emoji,CNET,4 days ago,"Apple, the company that brought you those animated Memoji you never use on the iPhone and made...",https://www.cnet.com/tech/mobile/apples-plan-to-win-the-generative-ai-race-involves-weird-emoji/
Should You Buy Apple Stock Before June 10? | The Motley Fool,The Motley Fool,3 days ago,One member of the collective that's been curiously left out of the conversation is Apple (AAPL...,https://www.fool.com/investing/2024/06/01/should-you-buy-apple-stock-before-june-10/
Apparent Nothing Phone 3 design leak has fans intrigued,Creative Bloq via Yahoo News,7 days ago,"Nothing Phone UI design. While iPhone 16 rumours come in thick and fast, it seems we may have just...",https://www.yahoo.com/tech/apparent-nothing-phone-3-design-143508436.html
MKBHD shares behind-the-scenes look at Apple's iPhone durability testing [Video] - 9to5Mac,9to5Mac,5 days ago,"Ever wonder how Apple tests its iPhones for dust, water, drop protection, and more? Apple invited...",https://9to5mac.com/2024/05/29/behind-scenes-iphone-durability-testing-video-mkbhd/
Could this human-weasel hybrid from Maine join the ranks of Bigfoot?,Portland Press Herald,19 hours ago,"Good catch, as the Comegato is Maine’s newest addition to the cryptozoological monster manual....",https://www.pressherald.com/2024/06/03/could-this-human-weasel-hybrid-from-maine-join-the-ranks-of-bigfoot/
I Pitched “Hangry” for Dictionary Inclusion in 2003 and Was Rejected,Serious Eats via Yahoo News,4 days ago,"This is my story. Serious Eats / Unsplash One day in the spring of 2003—before Facebook, Instagram,...",https://www.yahoo.com/lifestyle/pitched-hangry-dictionary-inclusion-2003-170648742.html?fr=sycsrp_catchall
New Kino app by Halide developer is perfect for novice and pro videomakers,AppleInsider,5 days ago,"Photography app Halide now has a sister video app for iPhone called Kino, with grading presets,...",https://appleinsider.com/articles/24/05/29/new-kino-app-by-halide-developer-is-perfect-for-novice-and-pro-videomakers
Apple Unlikely to Launch New Hardware at Upcoming WWDC,The Mac Observer,19 hours ago,"With Apple’s Worldwide Developers Conference (WWDC) now just a week away from kicking off, we are coming across more information regarding what to expect. One such claim comes from Bloomberg ...",https://www.macobserver.com/news/apple-unlikely-to-launch-new-hardware-at-upcoming-wwdc/
Chinese startup Xreal banks big on AR,China Daily,19 hours ago,"Chinese augmented reality company Xreal has unveiled a phone-like device for its AR glasses, as it works hard to enrich the AR content to attract more people to try cutting-edge devices. As ...",http://www.chinadaily.com.cn/a/202406/03/WS665d6cfda31082fc043ca9a4.html
Is Apple Stock a Buy Now?,The Motley Fool via AOL,2 days ago,"Things are about to get better for Apple Apple's revenue in the second quarter of fiscal 2024 was down 4% from the year-ago period to $90.8 billion,...",https://www.aol.com/apple-stock-buy-now-111500136.html
Is Apple Stock a Buy Now?,Motley Fool via Yahoo Finance,2 days ago,"Things are about to get better for Apple Apple's revenue in the second quarter of fiscal 2024 was down 4% from the year-ago period to $90.8 billion,...",https://finance.yahoo.com/news/apple-stock-buy-now-111500604.html?fr=sycsrp_catchall
This 3-in-1 MagSafe charger is my new favorite travel accessory (and it supports Qi2),ZDNet,3 days ago,"What I really need is a dedicated travel kit for charging my gadgets, which include an iPhone, Apple...",https://www.zdnet.com/article/this-3-in-1-magsafe-charger-is-my-new-favorite-travel-accessory-and-it-supports-qi2/
New Kino app by Halide developers is perfect for novice and pro videomakers,AppleInsider,6 days ago,"Photography app Halide now has a sister video app for iPhone called Kino, with grading presets,...",https://appleinsider.com/articles/24/05/29/new-kino-app-by-halide-developers-is-perfect-for-novice-and-pro-videomakers
This is How Apple Torture Tests Its iPhones,PetaPixel,4 days ago,"Marques Brownlee was given an inside look at how Apple torture tests its iPhones and other products in its labs, ranging from IP testing, shaking, and...",https://petapixel.com/2024/05/30/this-is-how-apple-torture-tests-its-iphones/
Could a Virtual Workspace Replace Your Real Desk Anytime Soon?,Gizmodo via Yahoo News,3 days ago,"This week, we got a look at what the future holds for virtual workspaces from some ex-Magic Leap...",https://www.yahoo.com/tech/could-virtual-workspace-replace-real-120000552.html
"Breaking News, Business, Financial and Economic News, World News from EconoTimes",EconoTimes,19 hours ago,Does your service business need AI? To have any chance of achieving the goal adopted in the Paris...,http://www.econotimes.com/?page=2144
Greatest mechanical calculating devices of all time,Boing Boing,3 days ago,"Mechanical calculators are fascinating. While the iPhone or Android device you are likely reading this on is exponentially more powerful and useful,...",https://boingboing.net/2024/05/31/greatest-mechanical-calculating-devices-of-all-time.html
Man dressed as FedEx employee accused of stealing package from Simsbury front porch,NBC Connecticut,2 days ago,A man who was dressed as a FedEx employee is accused of stealing a package from a porch in Simsbury...,https://www.nbcconnecticut.com/news/local/man-dressed-as-fedex-employee-accused-of-stealing-package-from-simsbury-front-porch/3303678/
[5 Ways] How To Fix Could Not Activate Cellular Data Networks,The Mac Observer,3 days ago,There are few things more annoying than seeing the “Could Not Activate Cellular Data Networks” error...,https://www.macobserver.com/iphone/activate-cellular-data-networks/
Sonos' New Headphones Mostly Ace Our Tests - Video,CNET,20 hours ago,"While Sonos' first headphones are rather pricey at $449 -- and first and foremost, they turn out to...",https://www.cnet.com/videos/sonos-new-headphones-mostly-ace-our-tests-review/
Unsettled pattern returns with off and on downpours Sunday,WVLT-TV Knoxville,2 days ago,Our dry stretch of weather is coming to an end as rounds of showers and storms are set to impact our...,https://www.wvlt.tv/2024/06/01/unsettled-pattern-returns-with-off-downpours-sunday/
"TSMC's 2nm Chips On Track For 2025 Launch, With The iPhone 17 Pro Expected To Be The First Candidate...",Wccftech,6 days ago,Apple's custom silicon transition has been a major plus for the company and a milestone for the entire computer industry. The company has been making gigantic strides in developing its M series ...,https://wccftech.com/tsmc-2nm-chips-launch-2025/
Apple’s AI plans for the iPhone just leaked. Here’s everything we know,Digital Trends via Yahoo News,6 days ago,"At its annual developers conference next month, Apple will reportedly introduced AI-fueled versions...",https://www.yahoo.com/tech/apple-ai-plans-iphone-just-184235804.html
"These are the best iPhone apps and games of 2024 so far, according to Apple",TechRadar,6 days ago,"Every year Apple hands out Design Awards to the apps and games that it thinks really stand out (the 2023 winners are here): it's a prestigious accolade, and the shortlist for the 2024 batch ...",https://www.techradar.com/phones/iphone/these-are-the-best-iphone-apps-and-games-of-2024-so-far-according-to-apple
AKG K812,Mountain View Telegraph,20 hours ago,"The role of headphones in music production is changing. Never generally treated as a serious monitoring solution, they do tend towards a rather odd sense...",https://mvtelegraph.com/?p=1364493
Google Chrome Deadline—72 Hours To Update Or Delete Your Browser,Forbes,20 hours ago,Updated June 3 with details of second CISA deadline and ad blocker warning. For Google Chrome and...,http://www.forbes.com/sites/zakdoffman/2024/06/03/google-chrome-warning-72-hours-to-update-or-delete-your-browser/
Google Chrome Deadline—72 Hours To Update Or Delete Your Browser,Forbes,20 hours ago,Updated June 3 with details of second CISA deadline and ad blocker warning. For Google Chrome and...,https://www.forbes.com/sites/zakdoffman/2024/06/03/google-chrome-warning-72-hours-to-update-or-delete-your-browser/
RCS on iPhones Will Make Texting Android Users Feel Less Archaic,CNET,7 days ago,"For years, I was a nuisance to anyone with an iPhone. RCS is a protocol that replaces SMS (Short Message Service) and has a lot of the same features as iMessage, including ...",https://www.cnet.com/tech/mobile/rcs-on-iphones-will-make-texting-android-users-feel-less-archaic/
Clouds building to batches of afternoon rain,WVLT-TV Knoxville,3 days ago,Join us on the WVLT First Alert Weather app for iPhone or Android to stay informed on the go and in between newscasts. Saturday will feature partly...,https://www.wvlt.tv/2024/06/01/clouds-building-batches-afternoon-rain/
Father's Day Gift Guide 2024: The Best Strollers For Frequent Travelers,Forbes,20 hours ago,Celebrate the dad in your life this Father’s Day with a special gift – a stroller that will empower...,https://www.forbes.com/sites/robinraven/2024/06/03/fathers-day-gift-guide-2024-the-best-strollers-for-frequent-travelers/
Save £300 off the Galaxy S24 Ultra on Amazon UK right now,Neowin,20 hours ago,Are you looking for a new high-end phone? Amazon is currently running a deal for the Galaxy S24...,https://www.neowin.net/deals/save-300-off-the-galaxy-s24-ultra-on-amazon-uk-right-now/
"""SwiftKey"" offers accessible typing and customization",KFDX Wichita Falls,3 days ago,There has to be a better way to send messages than with the stock texting app that came loaded onto...,https://www.texomashomepage.com/what-the-tech/swiftkey-app-offers-accessible-typing-and-customization/
How To Fix Gpay Says SMS Limit Reached for Device Registration,The Mac Observer,3 days ago,"Did an error message saying, “You’ve reached the SMS limit for device registration” appear while...",https://www.macobserver.com/apple-pay/google-pay-sms-limit-device-registration/
Should You Buy Apple Before This Key June 10 Event?,The Motley Fool via AOL,2 days ago,"It's pretty much a given that Apple will announce software updates, as this has been the routine throughout the history of the annual event. This means...",https://www.aol.com/buy-apple-key-june-10-094000545.html
Apple’s Q2 2024 results – A thorough analysis,Android Headlines,20 hours ago,Apple has just recently announced its earnings for the second quarter of the year which basically refers to the first three months of the year; that is...,https://www.androidheadlines.com/2024/06/apples-q2-2024-results-a-thorough-analysis.html
Should You Buy Apple Before This Key June 10 Event?,Motley Fool via Yahoo Finance,2 days ago,"It's pretty much a given that Apple will announce software updates, as this has been the routine throughout the history of the annual event. This means...",https://finance.yahoo.com/news/buy-apple-key-june-10-094000404.html?fr=sycsrp_catchall
Should You Buy Apple Stock Before June 10?,Motley Fool via Yahoo Finance,3 days ago,One member of the collective that's been curiously left out of the conversation is Apple (NASDAQ: AAPL). The iPhone maker has historically kept its plans...,https://finance.yahoo.com/news/buy-apple-stock-june-10-081300885.html?fr=sycsrp_catchall
Behind the Scenes of iOS Updates: Why Your Battery Suffers Every Time,The Mac Observer,4 days ago,"Curious why you might be experiencing battery drain after an iOS update? Scouring the internet, it doesn’t take long to find folks claiming to experience issues with their battery after updating ...",https://www.macobserver.com/ios/ios-updates-battery/
Apple Music becoming integral to release strategies in India,Music Ally,21 hours ago,"This month: Amit looks into the impact of Apple Music in India, as the streaming platform slowly...",https://musically.com/2024/06/03/apple-music-becoming-integral-to-release-strategies-in-india/
"Apple to add Japan's 'My Number' ID card function to iPhone, Japan official says",Reuters via Yahoo News,5 days ago,-Apple CEO Tim Cook agreed at the request of Japanese Prime Minister Fumio Kishida to put Japan's...,https://www.yahoo.com/tech/apple-add-japans-number-id-022723172.html
"Apple to add Japan's 'My Number' ID card function to iPhone, Japan official says",Reuters via Yahoo Finance,5 days ago,-Apple CEO Tim Cook agreed at the request of Japanese Prime Minister Fumio Kishida to put Japan's...,https://finance.yahoo.com/news/apple-add-japans-number-id-022723618.html?fr=sycsrp_catchall
The Biggest Fintech Trends In The Next 10 Years,Forbes,21 hours ago,"Within a decade, it’s possible that AI will have evolved from its current role in assisting with financial decision-making and automating customer...",https://www.forbes.com/sites/bernardmarr/2024/06/03/the-biggest-fintech-trends-in-the-next-10-years/
"How to watch Florida students compete on 2024 Scripps Spelling Bee on iPhone, Android or TV",The News-Press,6 days ago,"Dev Shah of Largo, Florida, won 2023 Scripps National Spelling Bee with the word “psammophile.”...",https://www.news-press.com/story/news/2024/05/29/spelling-bee-scripps-florida-livestream-ion-espn-dev-shah/73888127007/
"How to watch Florida students compete on 2024 Scripps Spelling Bee on iPhone, Android or TV",Palm Beach Post via Yahoo News,6 days ago,"Dev Shah of Largo, Florida, won 2023 Scripps National Spelling Bee with the word “psammophile.” Where can you watch 2024 competition? ION TV, not ESPN",https://www.yahoo.com/news/watch-florida-students-compete-2024-112504202.html?fr=sycsrp_catchall
"How to watch Florida students compete on 2024 Scripps Spelling Bee on iPhone, Android or TV",The News-Press via Yahoo News,6 days ago,"Dev Shah of Largo, Florida, won 2023 Scripps National Spelling Bee with the word “psammophile.” Where can you watch 2024 competition? ION TV, not ESPN",https://www.yahoo.com/entertainment/watch-florida-students-compete-2024-112504923.html?fr=sycsrp_catchall
Should You Buy Apple Stock Before June 10?,The Motley Fool via AOL,3 days ago,One member of the collective that's been curiously left out of the conversation is Apple (NASDAQ: AAPL). The iPhone maker has historically kept its plans...,https://www.aol.com/buy-apple-stock-june-10-081300405.html
Is Apple Stock A Buy Ahead Of AI Reveal At WWDC Show?,Investor's Business Daily,7 days ago,"Consumer electronics giant Apple faces a bunch of challenges that have weighed on Apple stock,...",https://www.investors.com/research/apple-stock-buy-now/?src=A00220&yptr=yahoo
Opinion: Podcast Monologuing Is the New Mansplaining,The Daily Beast via Yahoo News,3 days ago,"Close your eyes, hold your breath for a moment and you can almost hear it. Even if your iPhone isn’t hooked up to your Bluetooth speaker, it’s in the...",https://www.yahoo.com/entertainment/opinion-podcast-monologuing-mansplaining-030028144.html?fr=sycsrp_catchall
Samsung beats Apple in Q1 2024 smartphone shipments,AppleInsider,4 days ago,"Apple isn't on top of the worldwide smartphone market in 2024 so far, though the iPhone did benefit from customers buying more premium models. The...",https://appleinsider.com/articles/24/05/31/apple-loses-to-samsung-in-q1-global-smartphone-shipments
iOS makes it more difficult to control the volume when casting media,Android Authority,4 days ago,"Following a recent iOS update, likely iOS 17.4, users casting media to other devices can no longer...",https://www.androidauthority.com/ios-difficult-control-volume-when-casting-3447744/
