Headline,Source,Posted,Description,Link
"How Does Apple Put The iPhone Through Rugged Testing, MKBHD Shares Inside View Of The Process — See...",Benzinga,4 days ago,"Popular tech YouTuber, Marques Brownlee, also known as MKBHD, has provided an inside look into the...",https://www.benzinga.com/news/24/05/39104665/how-does-apple-put-the-iphone-through-rugged-testing-mkbhd-shares-inside-view-of-the-process-see-the
"Apple Puts iPhone Durability Ahead of Easy Repairs, Exec Says - Slashdot",Slashdot,4 days ago,"Apple prioritizes device durability over easier repairs, according to John Ternus, the company's head of hardware engineering, in a recent interview with YouTuber MKBHD. ""It's objectively better ...",https://apple.slashdot.org/story/24/05/30/1647209/apple-puts-iphone-durability-ahead-of-easy-repairs-exec-says
"After a string of carrier service outages, satellite messaging in Android 15 could bring stability",Android Central via Yahoo News,10 hours ago,"AT&T, Verizon, iMessage, and Google News are just a few of the services people depend on everyday...",https://www.yahoo.com/tech/string-carrier-outages-satellite-messaging-162203701.html
"After a string of carrier service outages, satellite messaging in Android 15 could bring stability",Android Central,10 hours ago,"Last week, Google News and Verizon joined a growing list of critical services that have faced...",https://www.androidcentral.com/apps-software/after-a-string-of-carrier-service-outages-satellite-messaging-could-bring-stability
WWDC 2024: Will last year's Vision Pro reveal be followed by no hardware at all?,LaptopMag via Yahoo News,10 hours ago,How will Apple follow its Vision Pro reveal from last year's WWDC? Here's a preview of everything...,https://www.yahoo.com/tech/wwdc-2024-last-years-vision-161254836.html
We're getting word of Apple's iOS 18 AI plans ahead of the much anticipated iPhone 16 series launch,Pocket Tactics,7 days ago,"If this latest iOS 18 AI report proves correct, we’re in for a lot of new features with the next...",https://www.pockettactics.com/ios-18-ai
Classic Apple Move: New AI Features May Require Newer iPhones for On-Device Processing,The Mac Observer,4 days ago,Apple’s next big move might involve encouraging users towards the latest iPhone models. The company is betting that new AI features for iPhones will be ...,https://www.macobserver.com/news/classic-apple-move-new-ai-features-may-require-newer-iphones-for-on-device-processing/
How to use Surfshark on Apple TV,TechRadar,11 hours ago,"Apple TV might not be the biggest streaming platform out there, but it’s still home to tons of exclusive shows that you might want to watch while working...",https://www.techradar.com/tech/how-to-use-surfshark-on-apple-tv
"Nu metal veterans P.O.D. take us on a tour of their hometown, San Diego",Louder Sound via Yahoo News,11 hours ago,"P.O.D.'s fusion of rap and metal might pre-date nu metal, but the San Diego band still blew up when...",https://www.yahoo.com/entertainment/nu-metal-veterans-p-o-155417524.html?fr=sycsrp_catchall
iOS 18 just tipped for Control Center makeover — here’s what’s new,Tom's Guide via Yahoo News,1 day ago,Ios 18. iOS 18 is shaping up to be Apple's most significant update for iPhones in years. It's...,https://www.yahoo.com/tech/ios-18-just-tipped-control-163934498.html
"The biggest storylines of the Mavs-Celtics Finals. Plus, about the Caitlin Clark effect",New York Times,11 hours ago,Zach Harper catches you up on leaguewide news.,https://www.nytimes.com/athletic/5537221/2024/06/03/mavericks-celtics-luka-doncic-jayson-tatum-caitlin-clark-wnba-the-bounce/
Previewing Ski Portillo's 75th Anniversary Season With GM Miguel Purcell,POWDER Magazine via Yahoo News,11 hours ago,"Ski Portillo is Chile's oldest and most well-known ski resort. The iconic yellow hotel, stunning...",https://www.yahoo.com/lifestyle/previewing-ski-portillos-75th-anniversary-155338756.html?fr=sycsrp_catchall
"Today’s deals: $189 Apple Watch SE, $299 3D printer, $829 M2 MacBook Air, $300 GoPro HERO12 Black,...",BGR via Yahoo News,11 hours ago,"New week, new you, new deals! The massive Amazon Father’s Day sale is in full swing now, and hot new...",https://www.yahoo.com/tech/today-deals-189-apple-watch-155300047.html
"Sunny and humid Monday, ahead of afternoon storms on Tuesday",WVLT-TV Knoxville,1 day ago,Join us on the WVLT First Alert Weather app for iPhone or Android to stay informed on the go and in...,https://www.wvlt.tv/2024/06/02/sunny-humid-monday-ahead-afternoon-storms-tuesday/
How Food Critic Keith Lee Went From MMA Fighter to TikTok Star,Rolling Stone via Yahoo News,2 days ago,"“My eyes are getting [watery],” Keith Lee says, laughing as he works his way through the bun,...",https://www.yahoo.com/entertainment/food-critic-keith-lee-went-133000457.html?fr=sycsrp_catchall
"SpaceX rocket launch: Where to watch this week’s launch from Daytona, New Smyrna, Oak Hill",Daytona Beach News-Journal,11 hours ago,"Tuesday night launch window! Weather permitting, SpaceX Falcon 9 rocket launch should be visible in the Volusia County sky this week.",https://www.news-journalonline.com/story/news/2024/06/03/spacex-rocket-launch-florida-how-watch-volusia-daytona-smyrna-beach/73953820007/
"Why Brainstorm Brewhouse, a new Richmond brewery, is opening inside Black Heath Meadery",CBS 6 Richmond,11 hours ago,"The new brewery is a joint venture between Black Heath owner Bill Cavender, CM Bryant and Darryl Puller.",https://www.wtvr.com/news/local-news/brainstorm-brewhouse-richmond-brewery-june-3-2024
Subscribing to stuff from your iPhone is a waste of money.,The Verge,6 days ago,"Hank Green is mad about the price of YouTube Premium, because it’s more expensive than Premium is everywhere else. The reason why is all about buttons and links and app store commissions, and ...",https://www.theverge.com/2024/5/28/24166546/subscribing-to-stuff-from-your-iphone-is-a-waste-of-money
Google won’t index sites that do not work on mobile devices after July 5,Search Engine Land,11 hours ago,“The small set of sites we’ve still been crawling with desktop Googlebot will be crawled with mobile...,https://searchengineland.com/google-wont-index-sites-that-do-not-work-on-mobile-devices-after-july-5th-442851?yptr=yahoo
Foldable phones are increasingly popular—and Samsung's share of the market is dropping,Fortune,11 hours ago,"Then, of course, Samsung and other manufacturers went on to make something of a success of the folding phone. Last week, Counterpoint Research said the global market for folding smartphones ...",https://fortune.com/2024/06/03/foldable-phones-market-share-samsung-huawei/
"Top U.S. Intelligence Agency Shares Major Security Tip to Protect iPhone, Android Users",Men's Journal via Yahoo News,3 days ago,The U.S. National Security Agency has released a mobile devices best practices guide to help...,https://www.yahoo.com/tech/top-u-intelligence-agency-shares-203752380.html
"Apple's iPhone sales in China jump 52% in April, data shows",AOL,7 days ago,"Apple's smartphone shipments in China were 52% higher in April than a year ago, extending a rebound seen in the previous month, according to data from a research firm affiliated the Chinese ...",https://www.aol.com/news/apples-iphone-sales-china-jump-084610771.html
"Spotify subscriptions just got more expensive, and users aren't happy",TheStreet.com,11 hours ago,Spotify just announced a major change that is frustrating its customers. Spotify (SPOT) wants its customers to shell out more cash for its services. The audio streaming company just announced ...,https://www.thestreet.com/technology/spotify-users-arent-happy-price-increase
Nothing Unveils New Phone (2a) Special Edition To Challenge iPhone,Forbes,6 days ago,"Out of nowhere, Nothing just released a new smartphone. It’s a special edition of the latest model,...",https://www.forbes.com/sites/davidphelan/2024/05/29/nothing-unveils-new-phone-2a-special-edition-to-challenge-iphone/
Photographer Who Captured Reagan Assassination Attempt Dies Age 77,PetaPixel,11 hours ago,Pulitzer prize-winning photographer Ron Edmonds has died at age 77. Edmonds was the senior White...,https://petapixel.com/2024/06/03/pulitzer-winning-photographer-who-captured-reagan-assassination-attempt-dies-age-77-ron-edmonds/
How Apple TV+ Space Series ‘Constellation’ Pulled Off Those Zero Gravity Scenes,Variety via AOL,3 days ago,Some imperfect iPhone video shot by retired NASA astronaut Scott Kelly while he was commander of the...,https://www.aol.com/apple-tv-space-series-constellation-180500932.html
How Apple TV+ Space Series ‘Constellation’ Pulled Off Those Zero Gravity Scenes,Variety via Yahoo News,3 days ago,Some imperfect iPhone video shot by retired NASA astronaut Scott Kelly while he was commander of the...,https://www.yahoo.com/entertainment/apple-tv-space-series-constellation-180500495.html?fr=sycsrp_catchall
FWPD: Man arrested following hourslong standoff at Canterbury Green apartments,21Alive Fort Wayne,11 hours ago,A 26-year-old man was arrested early Monday morning following a domestic disturbance and subsequent...,https://www.21alivenews.com/2024/06/03/fwpd-man-arrested-following-hourslong-standoff-canterbury-green-apartments/
Charlotte begins construction on first all-electric firehouse,WCNC Charlotte,11 hours ago,"Once fully constructed, Charlotte's newly-reconstruction Firehouse #30 will be the first...",https://www.wcnc.com/article/news/local/charlotte-electric-firehouse-groundbreaking/275-7798608b-7af3-4316-a532-54b2d2905070
Nvidia Rises As AI Plans Ramp Up; Is Nvidia A Buy Now?,Investor's Business Daily,11 hours ago,"Nvidia rose on the first trading day in June, close to the all-time high of 1158.19 while a 10-for-1...",https://www.investors.com/research/nvda-stock-is-nvidia-a-buy/?src=A00220&yptr=yahoo
"Apple's iPhone sales in China jump 52% in April, data shows",StreetInsider,6 days ago,"Apple's smartphone shipments in China rose 52% in April from a year ago, extending a rebound seen in March, according to data from a research firm affiliated the Chinese government. The jump ...",https://www.streetinsider.com/Reuters/Apples+iPhone+sales+in+China+jump+52%25+in+April%2C+data+shows/23280395.html
M4 iPad Pro has a new security feature Apple hasn’t told us about - 9to5Mac,9to5Mac,12 hours ago,"Over the last few years, Apple has built a reputation for being strong on user privacy....",https://9to5mac.com/2024/06/03/m4-ipad-pro-security-feature-apple-hasnt-told-anyone-about/
Apple's Big AI Reveal: Will The Game Plan Impress Wall Street?,Investor's Business Daily,4 days ago,"Apple blazed the trail for hot tech trends with products like the Mac, the iPhone and the App Store....",https://www.investors.com/news/technology/apple-stock-aapl-ai-artificial-intelligence-wwdc/?src=A00220&yptr=yahoo
The Next Big Thing? Phone with Unscratchable Display raises the bar for future iPhone and Galaxy,PhoneArena,5 days ago,"It is a wonderful piece of hardware, for sure, but its price tag is way above what most people would...",https://www.phonearena.com/news/phone-with-unscratchable-display_id158869
"Restart your phone more often, US spy agency NSA warns users",dpa international via Yahoo News,12 hours ago,"Restarting a smartphone takes just a few moments, and yet it's something that many of us rarely take...",https://www.yahoo.com/tech/restart-phone-more-often-us-150057847.html
The Fitbit Sense 2 has just crashed to its lowest-ever price at Best Buy,TechRadar,12 hours ago,"If you’re looking for a new fitness tracker and you don’t want to wait until the 4th of July sales,...",https://www.techradar.com/health-fitness/smartwatches/the-fitbit-sense-2-has-just-crashed-to-its-lowest-ever-price-at-best-buy
Why Bluetooth sounds better on Android devices than on your iPhone,Pocket-lint,5 days ago,"If you want to think about the speed at which audio technology has moved, you can imagine a dramatic...",https://www.pocket-lint.com/use-android-device-for-bluetooth-over-iphone/
Apple slashed iPhone prices in China. Sales are bouncing back,News Channel Nebraska,5 days ago,"By Laura He, CNN",https://rivercountry.newschannelnebraska.com/story/50840671/apple-slashed-iphone-prices-in-china-sales-are-bouncing-back
Doly lets you generate 3D product videos from your iPhone,TechCrunch,6 days ago,"AniML, the French startup behind a new 3D capture app called Doly, wants to create the Photoroom of...",https://techcrunch.com/2024/05/27/doly-lets-you-generate-3d-product-videos-from-your-phone/
2 dead in Charlotte after separate shootings,WCNC Charlotte,2 days ago,"Two people are dead in Charlotte after separate overnight shootings, according to the Charlotte-Mecklenburg Police Department. You can listen now on...",https://www.wcnc.com/article/news/local/2-dead-charlotte-separate-shootings/275-8ce6aada-28bf-4c28-a4fe-69ea171b3793
8th Grade Graduation Gifts to Celebrate Their Big Day,Best Products via Yahoo News,12 hours ago,When you don't just want to give cash. Here are the best 8th grade graduation gifts according to...,https://www.yahoo.com/lifestyle/send-kid-off-high-school-200000285.html?fr=sycsrp_catchall
Sony updates its camera app to offer multi-cam monitoring,The Verge,12 hours ago,iPadOS users can remotely control up to four cameras at once.,https://www.theverge.com/2024/6/3/24170423/sony-monitor-control-app-multicam-final-cut-camera-update
ServiceNow CEO Bill McDermott: ‘We’re Putting AI To Work For People’,CRN,13 hours ago,"After a half-century of doing things one way in the enterprise software industry, it’s time for...",https://www.crn.com/news/ai/2024/servicenow-ceo-bill-mcdermott-we-re-putting-ai-to-work-for-people
America's new ally takes chunks out of China's economic cake,Newsweek,5 days ago,"Apple's iPhone manufacturing in India is on the rise, as China's share sharply declined at certain...",https://www.newsweek.com/china-india-apple-manufacturing-decline-supply-chain-1906122
Grant County police seeking information in teen’s 1987 disappearance,21Alive Fort Wayne,12 hours ago,"Nearly 37 years after a 16-year-old Grant County teen’s disappearance, police have sent a renewed...",https://www.21alivenews.com/2024/06/03/grant-county-police-seeking-information-teens-1987-disappearance/
What a generative AI iPhone could look like,Erie News Now Plus,7 days ago,"By Samantha Murphy Kelly, CNN",http://www.erienewsnow.com/story/50836555/what-a-generative-ai-iphone-could-look-like
OnePlus 13 leak reveals missing feature but there’s a silver lining - Dexerto,Dexerto,12 hours ago,"The OnePlus 13 might not give you the option to charge the phone wirelessly, as a popular tipster...",https://www.dexerto.com/tech/oneplus-13-leak-reveals-missing-feature-but-theres-a-silver-lining-2756731/
"The rise of Huawei, the controversial Chinese tech giant that rivals Apple and is seen as a US...",Business Insider via Yahoo News,2 days ago,"It has expanded its product line to include wearable devices and, most notably, smartphones, which...",https://www.yahoo.com/tech/rise-huawei-controversial-chinese-tech-102801394.html
How Imagine Dragons became the sound of gaming culture,Washington Post,12 hours ago,"A decade ago, former games journalist Geoff Keighley was busy planning the first Game Awards, a...",https://www.washingtonpost.com/entertainment/video-games/2024/06/03/imagine-dragons-dan-reynolds-gaming/
How we test backup software at PCWorld,PC World,12 hours ago,After a system crash is not the time to find out your backup software failed or doesn't have a key feature you need. This is how we kick the tires to...,https://www.pcworld.com/article/2324672/how-pcworld-evaluates-and-tests-backup-software.html
Police asking for public’s help in finding “Busted Nose Bandit”,CW39 NewsFix,12 hours ago,"HOUSTON (KIAH) – A 5,000 cash reward is being offered to anyone who can help investigators find a man who has been dubbed the “Busted Nose Bandit.”",https://cw39.com/crime/police-asking-for-publics-help-in-finding-busted-nose-bandit/
"Books For MBAs: Tuck’s Vijay Govindarajan On How Data & AI Will Transform Products, Companies &...",Poets & Quants via Yahoo News,12 hours ago,"Vijay Govindarajan, a professor of strategy and innovation at Dartmouth’s Tuck School of Business,...",https://www.yahoo.com/tech/books-mbas-tuck-vijay-govindarajan-142928125.html
"Apple's iPhone sales in China jump 52% in April, data shows",Reuters,6 days ago,", opens new tab smartphone shipments in China rose 52% in April from a year ago, extending a rebound...",https://www.reuters.com/technology/apples-iphone-sales-april-jump-52-data-shows-2024-05-28/
10 things I'd like to see in VisionOS 2.0,ZDNet,12 hours ago,"Will VisionOS 2 be a game-changer for Apple's Vision Pro? It could be if Apple fixes these 10 VisionOS annoyances, hopefully at next week's WWDC.",https://www.zdnet.com/article/10-things-id-like-to-see-in-visionos-2-0/
Apple to add Japan’s ‘My Number’ ID card function to iPhone -Japan official,KFGO,5 days ago,TOKYO (Reuters) - Japanese Prime Minister Fumio Kishida held a video conference with Apple CEO Tim...,https://kfgo.com/2024/05/29/apple-to-add-japans-my-number-id-card-function-to-iphone-japan-official/
Apple to add Japan’s ‘My Number’ ID card function to iPhone -Japan official,WHTC 1450 Holland,5 days ago,TOKYO (Reuters) - Japanese Prime Minister Fumio Kishida held a video conference with Apple CEO Tim...,https://whtc.com/2024/05/29/apple-to-add-japans-my-number-id-card-function-to-iphone-japan-official/
Apple to add Japan’s ‘My Number’ ID card function to iPhone -Japan official,WSAU Wausau,5 days ago,TOKYO (Reuters) - Japanese Prime Minister Fumio Kishida held a video conference with Apple CEO Tim...,https://wsau.com/2024/05/29/apple-to-add-japans-my-number-id-card-function-to-iphone-japan-official/
The Last Kid in Ninth Grade Without an iPhone,The Cut,5 days ago,Greta always knew she would have to face her first year of high school without a phone. Few parent holdouts had much to say about the social and...,http://www.thecut.com/article/phones-teens-screentime-restrictions-jonathan-haidt.html
The Last Kid in Ninth Grade Without an iPhone,The Cut,5 days ago,Greta always knew she would have to face her first year of high school without a phone. Few parent holdouts had much to say about the social and...,https://www.thecut.com/article/phones-teens-screentime-restrictions-jonathan-haidt.html
"Apple TV+ unveils trailer for 'WondLa,' animated adventure series premiers June 28th",MacDailyNews,12 hours ago,"On Monday, Apple TV+ revealed the trailer for the animated adventure trilogy “WondLa,” hailing from...",https://macdailynews.com/2024/06/03/apple-tv-unveils-trailer-for-wondla-animated-adventure-series-premiers-june-28th/
Apple's WWDC 2024 Sneak Peek: Generative AI Strategy With Privacy Focus - Apple (NASDAQ:AAPL),Benzinga,12 hours ago,As Apple Inc AAPL gears up for its highly anticipated Worldwide Developers Conference (WWDC) on June...,https://www.benzinga.com/analyst-ratings/analyst-color/24/06/39138617/apples-wwdc-2024-sneak-peek-generative-ai-strategy-with-privacy-focus
Apple to add Japan's 'My Number' ID card function to iPhone -Japan official,Reuters,5 days ago,"Lithuanian webhosting firm Hostinger, which bills itself as a European rival to U.S. market leader...",https://www.reuters.com/technology/apple-add-japans-my-number-id-card-function-iphone-japan-official-2024-05-30/
"Halide developers launch Kino, a pro video app for the iPhone",The Verge,5 days ago,"One of Kino’s headline features is “Instant Grade,” which allows users to shoot footage with grade...",https://www.theverge.com/2024/5/29/24167144/kino-iphone-video-app-prores-log
iOS 18 report just revealed all the AI features coming to your iPhone,Tom's Guide,7 days ago,"New features, AI rumors and all sorts of changes to expect from the next version of Apple’s mobile...",https://www.tomsguide.com/phones/iphones/ios-18-leak-may-reveal-all-the-ai-features-coming-to-your-iphone
"Spotify Turns Up The Volume On Pricing, Premium Plans See A Hike What's Going On With Audio...",Benzinga,12 hours ago,Shares of Spotify Technology SA SPOT are trading higher after the company increased prices for its...,https://www.benzinga.com/general/entertainment/24/06/39138449/spotify-turns-up-the-volume-on-pricing-premium-plans-see-a-hike
West Plains Water Coalition hosting event to address PFAS contamination and cancer cluster findings,KREM.com Spokane,12 hours ago,The West Plains Water Coalition will hold an event on Monday evening to update the PFAS situation in...,https://www.krem.com/article/news/local/west-plains-water-coalition-pfas-contamination-cancer-cluster-findings/293-d1ce21e5-15de-4bd0-b47c-76f6bfc7eb92
Apple Shares Rise Slightly on Reports of Rising iPhone Shipments in China,Market Watch,7 days ago,"Apple shares rose slightly on reports that the company is staging a rebound in China, with shipments rising 52% according to Bloomberg. The stock is up nearly 13% month-to-date, putting it on ...",https://www.marketwatch.com/story/apple-shares-rise-slightly-on-reports-of-rising-iphone-shipments-in-china-05402eee
Samsung Galaxy Ring: Everything we know so far - Dexerto,Dexerto,12 hours ago,"The South Korean brand introduced a new line of products in the January edition of Galaxy Unpacked,...",https://www.dexerto.com/tech/samsung-galaxy-ring-2756247/
Android banking trojan masquerades as Google Play to steal your data,Fox News,13 hours ago,"Criminals constantly develop new ways to scam people, and their latest tactic involves infecting...",https://www.foxnews.com/tech/android-banking-trojan-masquerades-google-play-steal-your-data
The Verge’s 2024 summer gift guide,The Verge,13 hours ago,"The beauty of an iPad is that it allows you to be productive anytime, anywhere. It has an IP67 rating for dust and water resistance, along with punchy,...",https://www.theverge.com/24158599/summer-gift-ideas-2024-tech-gadgets-birthday-anniversary-wedding
GenAI ‘Is A Once-In-A-Generation Move’: ServiceNow CEO Bill McDermott,CRN,13 hours ago,"ServiceNow CEO Bill McDermott speaks with CRN about the company’s advances in using GenAI, how it’s time to change the way things are done and the way companies run, and how it is ensuring data ...",https://www.crn.com/news/ai/2024/genai-is-a-once-in-a-generation-move-servicenow-ceo-bill-mcdermott
Apple's iPhone sales in April jump 52% - Reuters By Investing.com,Investing.com,7 days ago,Apple's (NASDAQ:AAPL) smartphone shipments in China surged by 52% in April compared to the previous...,https://ca.investing.com/news/stock-market-news/apples-iphone-sales-in-april-jump-52--reuters-432SI-3429456
Apple's iPhone sales in April jump 52% - Reuters By Investing.com,Investing.com,7 days ago,Apple's (NASDAQ:AAPL) smartphone shipments in China surged by 52% in April compared to the previous...,https://uk.investing.com/news/stock-market-news/apples-iphone-sales-in-april-jump-52--reuters-432SI-3517361
Apple's iPhone sales in April jump 52% - Reuters By Investing.com,Investing.com,7 days ago,Apple's (NASDAQ:AAPL) smartphone shipments in China surged by 52% in April compared to the previous...,https://ng.investing.com/news/stock-market-news/apples-iphone-sales-in-april-jump-52--reuters-432SI-1374150
Apple's iPhone sales in April jump 52% - Reuters By Investing.com,Investing.com,7 days ago,Apple's (NASDAQ:AAPL) smartphone shipments in China surged by 52% in April compared to the previous...,https://ph.investing.com/news/stock-market-news/apples-iphone-sales-in-april-jump-52--reuters-432SI-1279164
Apple's iPhone sales in April jump 52% - Reuters By Investing.com,Investing.com,7 days ago,Apple's (NASDAQ:AAPL) smartphone shipments in China surged by 52% in April compared to the previous...,https://au.investing.com/news/stock-market-news/apples-iphone-sales-in-april-jump-52--reuters-432SI-3274856
"Apple to Add Japan's 'My Number' ID Card Function to IPhone, Japan Official Says",US News & World Report,5 days ago,"TOKYO (Reuters) -Apple CEO Tim Cook agreed at the request of Japanese Prime Minister Fumio Kishida to put Japan's ""My Number"" identification card functions onto iPhones, Japan's ...",https://www.usnews.com/news/technology/articles/2024-05-29/apple-to-add-japans-my-number-id-card-function-to-iphone-japan-official
Apple Shares Rise Slightly on Reports of Rising iPhone Shipments in China,Morningstar,7 days ago,"Apple shares rose slightly on reports that the company is staging a rebound in China, with shipments rising 52% according to Bloomberg. The stock is up nearly 13% month-to-date, putting it on ...",https://www.morningstar.com/news/dow-jones/202405286656/apple-shares-rise-slightly-on-reports-of-rising-iphone-shipments-in-china
CA Senate Preserves Big Corporate Tax Breaks That Benefit Some Cities,Lost Coast Outpost,15 hours ago,Democratic State Sen. Steve Glazer is behind a failed bill that would have ended controversial sales tax kickbacks to online retailers such as Apple and Amazon. Photo by Martin do Nascimento ...,https://lostcoastoutpost.com/2024/jun/3/ca-senate-preserves-big-corporate-tax-breaks-that/
Will there be new hardware at WWDC this year? - 9to5Mac,9to5Mac,13 hours ago,"WWDC 2024 is just one week away. In what’s expected to be a jam-packed software event, is there room for Apple to debut new hardware too? Historically, WWDC has always centered around software ...",https://9to5mac.com/2024/06/03/any-new-hardware-at-wwdc-this-year/
Virgin Media offers 'lowest ever' iPhone 15 Pro price but Sky is even cheaper,Daily Express,4 days ago,Other benefits include being able to use that data in the EU without paying anything extra plus...,https://www.express.co.uk/life-style/science-technology/1905667/iPhone-15-Pro-lowest-price-Virgin-Media-Sky
