Headline,Source,Posted,Description,Link
NSA Warns iPhone And Android Users To Turn It Off And On Again,Forbes,5 days ago,"Although some people might worry about the National Security Agency itself spying on their phones, the NSA has some sage advice for iPhone and android users concerned about ...",http://www.forbes.com/sites/daveywinder/2024/05/30/nsa-warns-iphone--android-users-to-turn-it-off-and-on-again/
All Things Tech: Save battery life on an iPhone,Citrus Chronicle Online,5 days ago,"I’m sure, like all of us who own an iPhone, you’ve said some choice words when realizing your battery is almost out of juice. However, the iPhone, by its...",https://www.chronicleonline.com/news/business/all-things-tech-save-battery-life-on-an-iphone/article_443e7e33-00f7-54e8-9b89-44df3ff8d51f.html
Iran iPhone users signal dismay over new models ban,The Citizens' Voice,5 days ago,"At a Tehran cafe, Hamid waves his mobile around hoping to latch onto a faint signal and thus bypass Iran's stringent ban on the latest models of iPhone.",https://www.citizensvoice.com/news/nation-world/iran-iphone-users-signal-dismay-over-new-models-ban/article_2ee6fe09-6624-5df2-8cf0-2f7743a878ba.html
Pixel 8's magic impresses iPhone's parents in the latest Google ad,Android Authority,6 days ago,The most recent ads in the series have featured the Pixel’s Circle to Search and Magic Editor...,https://www.androidauthority.com/best-phone-forever-ad-3446794/
Apple issues iPadOS 17.5.1 update just for iPad 10,AppleInsider,8 hours ago,"Apple has issued another update for iPadOS 17.5.1, but it's a release intended to fix something on the tenth-generation iPad. On May 20, Apple released...",https://appleinsider.com/articles/24/06/03/apple-updates-ipados-but-just-to-fix-something-on-only-the-ipad-10
"Can a $500 Pixel phone beat a $1,000 iPhone in a camera test? I found out",Digital Trends via Yahoo News,7 days ago,One of the things I personally like about Pixel phones is the camera and the resulting photos; it’s...,https://www.yahoo.com/tech/500-pixel-phone-beat-1-120057313.html
Switching From Android to iPhone? Here's How to Easily Transfer Your Data,CNET,7 days ago,"If you're ready to make the leap from an Android phone to an iPhone (like I did not too long ago),...",https://www.cnet.com/tech/mobile/switching-from-android-to-iphone-heres-how-to-easily-transfer-your-data/
"Use This App on Mac, iPhone, and iPad for Free AI Transcription",Lifehacker,6 days ago,"Aiko is an app for Mac, iPad, and iPhone that users Whisper—open-source technology created by OpenAI—to transcribe audio files. Aiko does not upload the file to the cloud ...",https://lifehacker.com/tech/aiko-free-ai-transcription-app
Two more arrested in connection to Winston-Salem murder,WFMY News 2 Greensboro,3 hours ago,Devonte Hayes was killed after being shot multiple times.,https://www.wfmynews2.com/article/news/crime/winston-salem-murder-devonshire-street-devonte-hayes/83-19626a8f-1f2a-475e-a133-c89f40365c61
"Starting today, Verizon offers new and existing customers iPhone 15, on us, for the first time ever",Morningstar,4 days ago,"Starting today, both new and existing Verizon customers can get the iPhone 15 with any iPhone trade-in, on us1, with the launch of the Ultimate Phone Upgrade ...",https://www.morningstar.com/news/globe-newswire/9146470/starting-today-verizon-offers-new-and-existing-customers-iphone-15-on-us-for-the-first-time-ever
What a generative AI iPhone could look like,WKBT La Crosse,7 days ago,"Generative AI, artificial intelligence that can provide thoughtful and thorough responses to questions and prompts, could potentially breathe new life...",https://www.news8000.com/lifestyle/money/what-a-generative-ai-iphone-could-look-like/article_a87cdeef-fce3-5b54-9e7e-8785b0b90e50.html
Owners of old iPhone model could get as much as $349 from Apple,San Francisco Chronicle,6 days ago,"Apple is set to pay as much as $349 to people who had audio issues on two older iPhone models,...",https://www.sfgate.com/tech/article/apple-iphone-audio-settlement-cash-19482386.php
"Shower chances rev up in Metro Detroit as heat, humidity linger",ClickOnDetroit,3 hours ago,"4Warn Weather – Following a night with mostly cloudy skies and lows in the mid- to upper-60s,...",https://www.clickondetroit.com/weather/2024/06/03/shower-chances-rev-up-in-metro-detroit-as-heat-humidity-linger/
Carpenter Uses Apple AirTags to Locate Thousands of Stolen Power Tools,ExtremeTech,8 hours ago,"For those who use power tools daily, being the victim of such theft means having to replace an expensive tool and often missing out on hours or days of work. After his tools were stolen several ...",https://www.extremetech.com/electronics/carpenter-uses-apple-airtags-to-locate-thousands-of-stolen-power-tools
"Apple's IPhone Sales in China Jump 52% in April, Data Shows",US News & World Report,7 days ago,"BEIJING (Reuters) -Apple saw its iPhone sales in China jump 52% in April from a year earlier, Reuters calculations based on industry data showed on Tuesday. The big increase ...",https://money.usnews.com/investing/news/articles/2024-05-28/apples-iphone-sales-in-april-jump-52-data-shows
"There's a new software update exclusive to iPad 10, but getting it is tricky",BGR,8 hours ago,"At the moment, it’s unclear why Apple released a revised build of iPadOS 17.5.1 for this specific model. With iOS 17.5.1, the company fixed a critical but “rare” bug where photos that experience ...",https://bgr.com/tech/theres-a-new-software-update-exclusive-to-ipad-10-but-getting-it-is-tricky/
Apple's durability testing is way more than a YouTuber can manage - iPhone Discussions on...,AppleInsider,5 days ago,"Apple has revealed how iPhone and iPad drop tests should really be done -- and are being done,...",https://forums.appleinsider.com/discussion/236556/apples-durability-testing-is-way-more-than-a-youtuber-can-manage
India Stocks Rally On Modi Election Wave. These Indian Bank Stocks Jump.,Investor's Business Daily,6 hours ago,"Many Western multinationals, including Apple and Walmart, have a large footprint in India, many...",https://www.investors.com/news/india-stocks-rally-modi-election-win-ibn-bank-stock/?src=A00220&yptr=yahoo
"I love this iPhone case's physical keyboard, but that isn't even its best feature",ZDNet,6 days ago,"It's called Clicks, and it just released its first product, the Clicks Keyboard. It's a physical...",https://www.zdnet.com/article/i-love-this-iphone-cases-physical-keyboard-but-that-isnt-even-its-best-feature/
Important ‘safety check’ feature all iPhone users should know about to secure their phone,UNILAD,5 days ago,"Thankfully, Apple has a plan in place to help keep you safe, and it's conveniently called 'Safety...",https://www.unilad.com/technology/news/iphone-safety-check-secure-phone-701245-20240530
What surprised me about ‘mom friends’ after becoming a parent,Today,3 hours ago,"Mom friends didn’t count, right? Well, not in the way your closest friends from college did.",https://www.today.com/parents/essay/real-mom-friends-rcna155241
Doly App Lets You Quickly Create 3D Product Videos on Your iPhone,Gadgets 360,7 days ago,"Doly, the 3D video rendering app for iPhone that can easily create 3D product videos, was launched...",https://www.gadgets360.com/apps/news/doly-iphone-render-3d-product-videos-camera-scanning-5762567
"This is how Apple ensures the iPhone's durability and water resistance, an inside look",TechSpot,5 days ago,"To see what kind of tests Apple submits its iPhones to, YouTube tech star Marques Brownlee visited one of the company's (usually super secretive) labs. The first of the clips ...",https://www.techspot.com/news/103192-inside-look-how-apple-ensures-iphone-durability-water.html
"You can get a 2022 MacBook Air at a record-low $829 today, and it's selling fast",AOL,12 hours ago,"'If you own an iPhone, the integration is perfect,' says one fan. 'No more Windows stuff for me.'",https://www.aol.com/lifestyle/you-can-get-a-2022-macbook-air-at-a-record-low-829-today-and-its-selling-fast-142539937.html
Here’s how new AI tech could change the iPhone,WKBT La Crosse,7 days ago,"Generative AI, artificial intelligence that can provide thoughtful and thorough responses to questions and prompts, could potentially breathe new life...",https://www.news8000.com/lifestyle/money/here-s-how-new-ai-tech-could-change-the-iphone/article_a87cdeef-fce3-5b54-9e7e-8785b0b90e50.html
Don't Get Lost on Summer Vacation. Download Offline Maps on Your iPhone Now,CNET,7 days ago,"If you're planning on going on vacation this summer, you might plan on using your iPhone's Maps app...",https://www.cnet.com/tech/mobile/dont-get-lost-on-summer-vacation-download-offline-maps-on-your-iphone-now/
Here’s how new AI tech could change the iPhone,CBS 58 Milwaukee,6 days ago,"Generative AI, artificial intelligence that can provide thoughtful and thorough responses to questions and prompts, could potentially breathe new life into Apple’s iPhone ...",https://www.cbs58.com/news/here-s-how-new-ai-tech-could-change-the-iphone
Here’s how new AI tech could change the iPhone,CBS 58 Milwaukee,6 days ago,"Generative AI, artificial intelligence that can provide thoughtful and thorough responses to questions and prompts, could potentially breathe new life into Apple’s iPhone ...",https://cbs58.com/news/here-s-how-new-ai-tech-could-change-the-iphone
"Starting today, Verizon offers new and existing customers iPhone 15, on us, for the first time ever...",Benzinga,4 days ago,"Starting today, both new and existing Verizon customers can get the iPhone 15 with any iPhone trade-in, on us1, with the launch of the Ultimate Phone Upgrade ...",https://www.benzinga.com/pressreleases/24/05/g39096795/starting-today-verizon-offers-new-and-existing-customers-iphone-15-on-us-for-the-first-time-ever
"TinCaps hosting baseball, softball equipment drive for kids in need",21Alive Fort Wayne,3 hours ago,"The Fort Wayne TinCaps are hosting an equipment drive at Parkview Field for children in need. The minor league baseball team is asking for donations of baseball and softball bats, helmets, and ...",https://www.21alivenews.com/2024/06/03/tincaps-hosting-baseball-softball-equipment-drive-kids-need/
Here’s how new AI tech could change the iPhone,KEYT 3 Santa Barbara,7 days ago,"Generative AI, artificial intelligence that can provide thoughtful and thorough responses to questions and prompts, could potentially breathe new life...",https://keyt.com/news/money-and-business/cnn-business-consumer/2024/05/28/what-a-generative-ai-iphone-could-look-like/
Here’s how new AI tech could change the iPhone,NewsWatch 12 Medford - Klamath Falls,7 days ago,"Generative AI, artificial intelligence that can provide thoughtful and thorough responses to questions and prompts, could potentially breathe new life...",https://www.kdrv.com/news/national/here-s-how-new-ai-tech-could-change-the-iphone/article_449c02d3-afdb-5305-a188-96d33b43a19d.html
Here’s how new AI tech could change the iPhone,WAAY-TV Huntsville,7 days ago,"Generative AI, artificial intelligence that can provide thoughtful and thorough responses to questions and prompts, could potentially breathe new life...",https://www.waaytv.com/news/here-s-how-new-ai-tech-could-change-the-iphone/article_ff9eff00-6c3b-546e-9367-5acc528bc845.html
Here’s how new AI tech could change the iPhone,KITV Honolulu,7 days ago,"Generative AI, artificial intelligence that can provide thoughtful and thorough responses to questions and prompts, could potentially breathe new life...",https://www.kitv.com/news/business/here-s-how-new-ai-tech-could-change-the-iphone/article_5f0b8232-458d-5d1e-bca4-b6da677fadf7.html
Here’s How New AI Tech Could Change the iPhone w/Siri | VIDEOs | EURweb,EURweb,5 days ago,"Generative AI, artificial intelligence that can provide thoughtful and thorough responses to...",https://eurweb.com/2024/ai-tech-could-change-the-iphone-w-siri/
Campad Electronics Offers a Wide Range of Phone Chargers,Digital Journal,8 hours ago,"It has wall phone chargers, car mobile phone chargers, desktop charging hubs, wireless charging stands, and chargers compatible with different mobile phones and devices, such as iPhones ...",https://www.digitaljournal.com/pr/news/prodigy-press-wire/campad-electronics-offers-wide-range-1621661776.html
Apple loses to Samsung in Q1 global smartphone shipments - iPhone Discussions on AppleInsider Forums,AppleInsider,3 days ago,"Apple isn't on top of the worldwide smartphone market in 2024 so far, though the iPhone did benefit...",https://forums.appleinsider.com/discussion/236576/apple-loses-to-samsung-in-q1-global-smartphone-shipments
iOS 18 report just revealed all the AI features coming to your iPhone,Tom's Guide via Yahoo News,7 days ago,"IOS 18 logo on iPhone in person's lap. We’ve been hearing a lot about iOS 18 ahead of WWDC 2024,...",https://www.yahoo.com/tech/ios-18-report-just-revealed-111106020.html
Microchip facility shuts telling us to expect under-display Face ID on iPhone 16 Pro line this year,PhoneArena,6 days ago,The story in the paper says that Apple stopped placing orders for these components due to changes being made to the next version of the iPhone. All of this could indicate ...,https://www.phonearena.com/news/face-id-under-display-iphone-16-pro-series_id158790
iOS 18: Are custom lock screen shortcuts finally coming to the iPhone?,PhoneArena,4 days ago,"See, it all boils down to the upcoming iPhone 16 range and its widely rumored Capture button, which...",https://www.phonearena.com/news/iOS-18-Are-custom-lock-screen-shortcuts-finally-coming-to-the-iPhone_id158640
And so it starts: the iPhone 15 Pro could be the cut-off for iOS 18's best AI features,TechRadar,4 days ago,"When it comes to AI-powered features on iPhones, there's good news and bad news. On the plus side,...",https://www.techradar.com/phones/iphone/and-so-it-starts-the-iphone-15-pro-could-be-the-cut-off-for-ios-18s-best-ai-features
Apple slashed iPhone prices in China. Sales are bouncing back | CNN Business,CNN.com,6 days ago,Editor’s Note: Sign up for CNN’s Meanwhile in China newsletter which explores what you need to know...,https://www.cnn.com/2024/05/29/tech/china-apple-sales-rebound-price-cuts-intl-hnk/index.html
"Poco F6 Pro Review: You've done it again, Poco!",Android Headlines,3 hours ago,"Well, you get one of the greatest kinds of phones out there, the Flagship Killer. The Xiaomi Poco brand has been pumping out phones like these over the...",https://www.androidheadlines.com/2024/06/poco-f6-pro-specs-screen-camera-price.html
Keep your iPhone filled up on the go with this portable MagSafe charger for 41% off,Macworld,7 days ago,"If there’s something I hate a lot nowadays, it is seeing the battery life draining away, as I know...",https://www.macworld.com/article/2347197/keep-your-iphone-filled-up-on-the-go-with-this-portable-magsafe-charger-for-41-off.html
"Counterfeit iPhone, iPad scheme cost Apple millions, feds say",KTLA-TV Los Angeles,3 days ago,Five Chinese nationals in the Los Angeles area are accused of stealing more than $12 million worth...,https://ktla.com/news/california/counterfeit-iphone-ipad-scheme-cost-apple-millions-feds-say/
Apple Arcade games: Latest releases for iPhone and more - 9to5Mac,9to5Mac,4 days ago,You can learn more about and download all the latest games by heading to the Arcade tab in the App...,https://9to5mac.com/2024/05/31/apple-arcade-games/
"If you had an iPhone 7 with audio problems, your settlement deadline is soon - iPhone Discussions on...",AppleInsider,5 days ago,"Earlier in 2024, Apple agreed to settle a class action suit over audio issues with the iPhone 7 -- but conditions are very limited and the time to apply is almost over. Plus ...",https://forums.appleinsider.com/discussion/236566/if-you-had-an-iphone-7-with-audio-problems-your-settlement-deadline-is-soon
"Opinion | Apple, Tesla lawsuit victories seen as ‘rule-of-law’ message to foreign businesses",South China Morning Post,4 hours ago,"In the past two years, China’s image as an ideal destination for foreign investment has been...",https://www.scmp.com/opinion/china-opinion/article/3265156/apple-tesla-win-lawsuits-china-beijing-projects-rule-law-message-foreign-businesses
"‘The Morning Show’ Emmy FYC event: Red carpet interviews with Billy Crudup, Jon Hamm, Karen Pittman...",Gold Derby via Yahoo News,4 hours ago,"On Sunday, June 2, Apple TV+ celebrated “The Morning Show” with an FYC Emmys event at Paramount...",https://www.yahoo.com/entertainment/morning-show-emmy-fyc-event-230027747.html?fr=sycsrp_catchall
Gonzaga sophomore runner to make history this week at track nationals,KREM.com Spokane,4 hours ago,"For the first time ever, a Gonzaga female athlete is headed to Eugene to compete in a national...",https://www.krem.com/article/sports/gonzaga-bulldogs/gonzaga-runner-to-make-history/293-3b27c95b-dfc7-45bc-a0ae-643115838c81
Apple’s China iPhone Shipments Up 52% as Rebound Gains Steam,Bloomberg via Yahoo Finance,7 days ago,(Bloomberg) -- Apple Inc.’s iPhone staged a rebound in China last month with shipments rising 52%...,https://finance.yahoo.com/news/apple-china-iphone-shipments-52-082637690.html?fr=sycsrp_catchall
Android Users Are Receiving Distorted GIFs From iPhone Users And It Might Be Due To Cross Platform...,Wccftech,6 days ago,A strange issue has popped up recently that is causing distorted GIFs to be sent on Android phones from iPhone users. The GIFs exchanged from the iPhone ...,https://wccftech.com/android-users-receiving-gif-from-iphone/
Apple wants to make iPhones that ‘never fail’ rather than ‘super-easy to repair’ devices – but it’s...,TechRadar via Yahoo News,3 days ago,"IPhone 15 Pro Max on a beige background. Apple's Head of Hardware Engineering, John Ternus, says his...",https://www.yahoo.com/tech/apple-wants-iphones-never-fail-093038331.html
App of the day: SwiftKey,KWCH,14 hours ago,The default keyboards that came pre-installed on iPhone and Android devices are just what we use because they’re there. If you’re not satisfied with the...,https://www.kwch.com/2024/06/03/app-day-swiftkey/
What a generative AI iPhone could look like | CNN Business,CNN.com,7 days ago,"Generative AI, artificial intelligence that can provide thoughtful and thorough responses to...",https://www.cnn.com/2024/05/28/tech/ai-iphone/index.html
Apple works to build better recycling robots,MacDailyNews,11 hours ago,Apple is working to transform how electronics are recycled with a robot named “Daisy” that disassembles iPhone so that rare earth and other metals can be...,https://macdailynews.com/2024/06/03/apple-works-to-build-better-recycling-robots/
The iPhone is about to embark on a multi-year upgrade cycle due to IntelliPhones says analyst,PhoneArena,3 days ago,"Apple did not invent the smartphone. Now, more than 17 years after the smartphone industry was...",https://www.phonearena.com/news/the-iphone-is-about-to-embark-on-a-multi-year-upgrade-cycle_id158949
How to Transfer Data from Android to iPhone: A Step-by-Step Guide,Mobile & Apps,5 days ago,Mobile technology is progressing rapidly and users frequently face a choice of migrating from one...,http://www.mobilenapps.com/articles/46700/20240529/transfer-data-android-iphone-step-guide.htm
How to Transfer Data from Android to iPhone: A Step-by-Step Guide,Mobile & Apps,5 days ago,Mobile technology is progressing rapidly and users frequently face a choice of migrating from one...,https://www.mobilenapps.com/articles/46700/20240529/transfer-data-android-iphone-step-guide.htm
"It looks like AI is going to put Siri on steroids, letting you control your iPhone with precision",PhoneArena,4 days ago,"Even before ChatGPT was released, Siri wasn't exactly anyone's favorite voice assistant, and in the...",https://www.phonearena.com/news/It-looks-like-AI-is-going-to-put-Siri-on-steroids-letting-you-control-your-iPhone-with-precision_id158901
Apple saw a huge year-over-year iPhone sales recovery in China in April - AAPL Investors Discussions...,AppleInsider,7 days ago,"China's main market research company is out with its latest data, and as the iPhone 16 creeps...",https://forums.appleinsider.com/discussion/236532/apple-saw-a-huge-year-over-year-iphone-sales-recovery-in-china-in-april
iOS 18: AI-generated custom emojis are reportedly arriving to iPhone soon,Mashable,6 days ago,"With tech giants like Google, Microsoft, and OpenAI all recently sharing big AI updates at their...",https://mashable.com/article/apple-iphone-ios-18-ai-generated-emojis
Check out the Queer Art Walk in downtown Spokane at First Friday,KREM.com Spokane,4 hours ago,"The Queer Art Walk will feature queer artists in support of Pride Month. In June, there will be 16...",https://www.krem.com/article/entertainment/check-out-queer-art-walk-downtown-spokane-this-friday-first-friday/293-c38de0eb-a6f8-445c-a1fb-15e693574fe4
Galaxy Z Flip 6 might have the innovation Apple needs to make a foldable iPhone,BGR,5 days ago,"About a week ago, I looked at a Galaxy Z Fold 6 display rumor and realized how important it might be...",https://bgr.com/tech/galaxy-z-flip-6-might-have-the-innovation-apple-needs-to-make-a-foldable-iphone/
iOS 18: AI-generated custom emojis are reportedly arriving to iPhone soon,Mashable,6 days ago,"With tech giants like Google, Microsoft, and OpenAI all recently sharing big AI updates at their...",https://sea.mashable.com/tech/32795/ios-18-ai-generated-custom-emojis-are-reportedly-arriving-to-iphone-soon
Here’s how iOS 18 could change the way you use your iPhone,Digital Trends via Yahoo News,4 days ago,"Apple will reportedly let Siri interact with your iPhone apps, and down the road, it will also be...",https://www.yahoo.com/tech/ios-18-could-change-way-211234612.html
"If you had an iPhone 7 with audio problems, your settlement deadline is soon",AppleInsider,5 days ago,"Earlier in 2024, Apple agreed to settle a class action suit over audio issues with the iPhone 7 — but conditions are very limited and the time to apply is almost over. Plus ...",https://appleinsider.com/articles/24/05/30/if-you-had-an-iphone-7-with-audio-problems-your-settlement-deadline-is-soon
"BofA reiterates Apple as 'Top Pick,' expects AI to power significant multi-year iPhone upgrade cycle",MacDailyNews,5 days ago,"In a note to clients Wednesday, Bank of America reiterated Apple as a top pick, maintaining a “Buy” rating and a price target of $230 on the stock, as BofA analysts expect AI to power a significant ...",https://macdailynews.com/2024/05/29/bofa-reiterates-apple-as-top-pick-expects-ai-to-power-significant-multi-year-iphone-upgrade-cycle/
"Apple’s China iPhone sales in April jump 52%, data shows",WHTC 1450 Holland,7 days ago,"(Corrects to specify sales in China in headline, paragraph 1) BEIJING (Reuters) -Apple saw its ...",https://whtc.com/2024/05/28/apples-china-iphone-sales-in-april-jump-52-data-shows/
"Apple’s China iPhone sales in April jump 52%, data shows",WSAU Wausau,7 days ago,"(Corrects to specify sales in China in headline, paragraph 1) BEIJING (Reuters) -Apple saw its ...",https://wsau.com/2024/05/28/apples-china-iphone-sales-in-april-jump-52-data-shows/
KCPD looking for missing teen in need of medication,FOX 4 Kansas City,4 hours ago,Police say Talla Diop was last seen around noon Friday in the area of E. 26th Street and Troost Avenue.,https://fox4kc.com/news/kcpd-looking-for-missing-teen-in-need-of-medication/
The Fujifilm X100VI is my first ever camera – here are five things it's taught me about photography...,TechRadar,2 days ago,"The iPhone 15 Pro Max might well be the best cameraphone I have ever owned, but it has never quite...",https://www.techradar.com/cameras/compact-cameras/the-fujifilm-x100vi-is-my-first-ever-camera-here-are-five-things-its-taught-me-about-photography-that-my-smartphone-cant
AirTag crucial to recovery of $5 million of stolen tools in Metro DC - iPhone Discussions on...,AppleInsider,3 days ago,"After getting fed up with overnight thefts of tools, a Northern Virginia carpenter planted AirTags...",https://forums.appleinsider.com/discussion/236579/airtag-crucial-to-recovery-of-5-million-of-stolen-tools-in-metro-dc
"As Apple's iPhone 16 Launch Nears, Report Says More Than Half Of World's Smartphones Will Be AI...",Benzinga,6 days ago,"Ahead of the highly-anticipated launch of Apple Inc.'s AAPL iPhone 16 with AI integration, market...",https://www.benzinga.com/news/24/05/39060951/as-apples-iphone-16-launch-nears-report-says-more-than-half-of-worlds-smartphones-will-be-ai-capable
The NSA Says You Should Restart Your Phone Weekly: Here's Why,PC Magazine,5 hours ago,"How often do you turn off your phone? In our smartphone-obsessed world, it's probably not a regular...",https://www.pcmag.com/news/the-nsa-says-you-should-restart-your-phone-weekly-heres-why
iPhone Shipments in China Soar: Are Apple Shares a Buy?,Zacks via Yahoo Finance,6 days ago,"Uncertainties concerning China sales have bogged down Apple shares, with some investors even...",https://finance.yahoo.com/news/iphone-shipments-china-soar-apple-211800341.html?fr=sycsrp_catchall
The NSA Says You Should Restart Your Phone Weekly: Here's Why,PC Magazine,5 hours ago,"How often do you turn off your phone? In our smartphone-obsessed world, it's probably not a regular...",https://me.pcmag.com/en/security/23948/the-nsa-says-you-should-restart-your-phone-weekly-heres-why
This versatile charging cable makes empty batteries yesterday's problem,Boing Boing,12 hours ago,"It also can do more than just charge one gadget — this thing boasts six-in-one capabilities, as it...",https://boingboing.net/?p=1020788
