Headline,Source,Posted,Description,Link
"iPhone 16 Pro will break a world record with this new feature, according to new reports",Mashable,10 hours ago,"The iPhone 16 Pro and iPhone 16 Pro Max are expected to break a world record, according to two...",https://mashable.com/article/iphone-16-pro-thinnest-bezels
iPhone 7 Settlement: Your Deadline to File a Class-Action Lawsuit Claim Is June 3,InvestorPlace,4 days ago,Owners of the iPhone 7 only have a few days left to file a claim for a settlement in the...,https://investorplace.com/2024/05/iphone-7-settlement-your-deadline-to-file-a-class-action-lawsuit-claim-is-june-3rd/
iPhone 16: Get the Inside Scoop on the Most Credible Apple Rumors,CNET,4 days ago,"It's been more than eight months since the iPhone 15 launched, and as Apple's Worldwide Developers...",https://www.cnet.com/tech/mobile/iphone-16-get-the-inside-scoop-on-the-most-credible-apple-rumors/
The Rumored iPhone 16 Feature I'm Most Excited For,CNET,15 hours ago,"When it comes to the iPhone 16, reports suggest many new features will be specific to the Pro models...",https://www.cnet.com/tech/mobile/the-iphone-16-feature-im-most-excited-for/
"iPhone 16 Pro: price and release date rumours, leaked photos and what to expect",What Hi-Fi? via Yahoo News,16 hours ago,An Apple iPhone 15 Pro Max held in landscape orientation in front of a table bearing an incense...,https://www.yahoo.com/tech/iphone-16-pro-price-release-105824257.html
Apple says that this iPhone model is officially obsolete,PhoneArena,1 hour ago,Apple officially added the iPhone 5s to its list of obsolete iPhone models while the sixth-gen iPod...,https://www.phonearena.com/news/this-iphone-model-is-obsolete_id159009
The iPhone 5S Is Now Officially Obsolete,Gizmodo via Yahoo News,13 hours ago,"The inexorable march toward the grave continues for all of us, though at the very least, we don’t have a capricious deity named Apple deciding our fate....",https://www.yahoo.com/tech/iphone-5s-now-officially-obsolete-132500482.html
Did you own an iPhone 7? Owners may be owed money. Here's how to submit settlement claim,Gannett via AOL,11 hours ago,"If you experienced audio chip issues with the iPhone 7 and the iPhone 7 Plus, you may be eligible...",https://www.aol.com/did-own-iphone-7-owners-154133836.html
The iPhone 16 Pro may set a new record for smartphone displays,Digital Trends via Yahoo News,12 hours ago,We have more confirmation on one of the Apple iPhone 16 Pro Max's biggest new features. It would...,https://www.yahoo.com/tech/iphone-16-pro-may-set-144308533.html
iPhone 16 Pro display bezels could be 'narrowest in the world',Tom's Guide,17 hours ago,One of the iPhone 16 Pro and iPhone 16 Pro Max's most impressive engineering features could be their...,https://www.tomsguide.com/phones/iphones/iphone-16-pro-display-bezels-could-be-narrowest-in-the-world
iPhone 16 Pro design teased to be 'very close to the dream form',Macworld,10 hours ago,Apple's next flagship iPhone will reportedly have extremely thin bezels. WWDC may be just a week...,https://www.macworld.com/article/2355006/iphone-16-pro-max-design-display-narrowest-bezels.html
How to Force Restart or Reset Any iPhone,CNET,15 hours ago,"If your iPhone isn't responding and you're not able to power it off and then on again, you can force restart it to hopefully fix the issue. Meaning that...",https://www.cnet.com/tech/mobile/how-to-restart-reset-iphone-all-models/
A new iPhone 16 Pro bezels rumor suggests we're getting plenty of screen space with this year's...,Pocket Tactics,11 hours ago,"The iPhone 16 Pro series might be getting bigger displays, but the slimmest bezels in the world...",https://www.pockettactics.com/iphone-16-pro-bezels
"Apple iPhone 16 Pro To Boast Record-Breaking Design, Leak Claims",Forbes,22 hours ago,"The next iPhones will have a different look when they are released this September, it seems. It's...",https://www.forbes.com/sites/davidphelan/2024/06/03/apple-iphone-16-pro-to-boast-record-breaking-design-leak-claims/
"5 ways your iPhone can make international travel easier, safer",Fox News via Yahoo News,17 hours ago,"From navigating new cities to communicating in different languages, there are plenty of potential...",https://www.yahoo.com/tech/5-ways-iphone-international-travel-100030353.html
Apple says this iPhone is now obsolete — what it means for you,Tom's Guide,10 hours ago,"Apple recently announced that the iPhone 5s has been labeled obsolete, meaning anyone still using...",https://www.tomsguide.com/phones/iphones/apple-says-this-iphone-is-now-obsolete-what-it-means-for-you
"iPhone Fold is on the way, but you're still going to have to wait a while - iPhone Discussions on...",AppleInsider,12 hours ago,"Apple's long-rumored foldable iPhone is still a hot topic, but analysts believe Apple won't be...",https://forums.appleinsider.com/discussion/236588/iphone-fold-is-on-the-way-but-youre-still-going-to-have-to-wait-a-while
This old iPhone is now obsolete,Quartz,12 hours ago,"The inexorable march toward the grave continues for all of us, though at the very least, we don’t have a capricious deity named Apple deciding our fate....",https://qz.com/apple-iphone-5s-obsolete-1851515575
One of the iPhone apps you use most will finally be fixed in iOS 18,BGR,12 hours ago,Apple will finally unveil generative AI features built for the iPhone. One exciting feature...,https://bgr.com/tech/one-of-the-iphone-apps-you-use-most-will-finally-be-fixed-in-ios-18/
Analysts think iPhone Fold could arrive by 2027,AppleInsider,13 hours ago,"Apple's long-rumored foldable iPhone is still a hot topic, but analysts believe Apple won't be bringing out its own foldable smartphone until 2027 at the...",https://appleinsider.com/articles/24/06/03/iphone-fold-is-on-the-way-but-youre-still-going-to-have-to-wait-a-while
"iOS 18 May Bring an Upgrade to iPhone’s Control Centre, Suggests Report",Gadgets 360,12 hours ago,"Apple is gearing up for its Worldwide Developers Conference (WWDC) 2024 which kicks off on June 10,...",https://www.gadgets360.com/mobiles/news/ios-18-features-control-centre-music-widget-iphone-report-apple-5808255
Check iPhone and Apple Watch emergency features - 9to5Mac,9to5Mac,7 hours ago,Modern Apple devices include important automatic emergency capabilities to get help in case of...,https://9to5mac.com/2024/06/03/check-emergency-iphone-and-apple-watch-features/
"5 ways your iPhone can make international travel easier, safer",Fox News,17 hours ago,"Exploring the world is an incredible experience, but let's be honest, international travel can...",https://www.foxnews.com/tech/5-ways-your-iphone-can-make-international-travel-easier-safer
iOS 18: Everything We Know So Far About Apple's New iPhone Software,CNET,16 hours ago,"The company is expected to unveil the next version of its iPhone software, iOS 18. In November,...",https://www.cnet.com/tech/mobile/ios-18-everything-we-know-so-far-about-apples-new-iphone-software/
"Apple Loop: iPhone 16 Pro Details, iOS 18’s AI Plans, iPhone 14 Pro Special Offer",Forbes,4 days ago,"This week’s Apple headlines:iPhone 16 Pro specs, iOS 18 details, Apple’s AI marketing plans, an OLED...",https://www.forbes.com/sites/ewanspence/2024/05/31/apple-news-headlines-iphone-16-pro-ios-18-ai-ipad-pro-logo-macbook-pro-oled/
You Can Finally Play 3DS Games on Your iPhone With This App,Lifehacker,7 hours ago,"A new emulator app on the iOS App Store, Folium, lets you play 3DS games on your iPhone. It also...",https://lifehacker.com/entertainment/how-to-play-3ds-games-on-iphone
Is the iPhone Fold doomed to follow Apple Vision Pro's fate?,PhoneArena,16 hours ago,"The rumor mill has been spinning its wheels and stones for years now, spitting speculative flour...",https://www.phonearena.com/news/iphone-fold-doomed-to-follow-apple-vision-pros-fate_id158915
Apple's iPhone 16 Pro could have world's thinnest bezels - iPhone Discussions on AppleInsider Forums,AppleInsider,12 hours ago,A new leak about the iPhone 16 Pro goes further than previous claims about the bezels and says they...,https://forums.appleinsider.com/discussion/236585/apples-iphone-16-pro-could-have-worlds-thinnest-bezels
How to take a scrolling screenshot on iPhone - 9to5Mac,9to5Mac,11 hours ago,Taking a screenshot on your iPhone is probably second nature but what about a screenshot to capture...,https://9to5mac.com/2024/06/03/take-scrolling-screenshot-on-iphone/
WWDC 2024 should kick off huge Apple and OpenAI partnership — here's how it could transform your ...,Tom's Guide,9 hours ago,"Back in late April, reports surfaced that Apple reopened dialog with OpenAI to bring ChatGPT...",https://www.tomsguide.com/ai/chatgpt/apple-and-openai-deal-should-be-announced-at-wwdc-heres-how-it-could-transform-your-iphone
Five arrested after stealing $12 million in fake iPhone exchange scheme - Dexerto,Dexerto,13 hours ago,Five people have been arrested in California for stealing over $12 million from Apple by exchanging...,https://www.dexerto.com/tech/five-arrested-after-stealing-12-million-in-fake-iphone-exchange-scheme-2756487/
iPhone 16 Pro could dethrone Galaxy S24 as the thinnest-bezeled smartphone,Android Authority,13 hours ago,"At this point, Apple is polishing its iPhones by gradually improving their design, SoCs, cameras,...",https://www.androidauthority.com/iphone-16-pro-thinnest-smartphone-bezels-3448283/
iPhone 16 Pro leak reveals razor-thin bezels in updated design - Dexerto,Dexerto,12 hours ago,New leaks suggest the upcoming iPhone 16 Pro could have bezels even thinner than the Samsung Galaxy...,https://www.dexerto.com/tech/iphone-16-pro-leak-reveals-razor-thin-bezels-in-updated-design-2756757/
iPhone 16 Pro series to have the thinnest bezels on the market,Android Headlines,14 hours ago,"The iPhone 16 Pro Max will have the thinnest bezels out there, followed closely by the iPhone 16...",https://www.androidheadlines.com/2024/06/iphone-16-pro-series-to-have-thinnest-bezels.html
WWDC 2024: What to Expect and How to Watch Apple's iOS 18 Event,CNET,9 hours ago,"The iPhone maker has been characteristically tight-lipped about what's to come during its WWDC keynote, but there's been plenty of speculation about what the company might ...",https://www.cnet.com/tech/mobile/wwdc-2024-what-to-expect-and-how-to-watch-apples-ios-18-event/
iPhone 7 Settlement Could Mean $349 in Your Pocket: How to Get Paid,PC Magazine,6 days ago,"Apple has settled a class-action lawsuit regarding audio issues with both phone variants, which...",https://www.pcmag.com/news/iphone-7-settlement-could-mean-349-in-your-pocket-how-to-get-paid
The best VPN for iPhone: Which iOS VPN should you pick?,Mashable,10 hours ago,"Note: In 2022, several security researchers and VPN providers flagged ongoing vulnerabilities in...",https://sea.mashable.com/vpn/32866/the-best-vpn-for-iphone-which-ios-vpn-should-you-pick
The iPhone 16 Pro Max could have the world’s thinnest phone bezels,TechRadar,16 hours ago,"The iPhone 15 Pro and iPhone 15 Pro Max already have thin bezels, but it looks like the iPhone 16...",https://www.techradar.com/phones/iphone/the-iphone-16-pro-max-could-have-the-worlds-thinnest-phone-bezels
Here's the pitch deck my tween made me to get an iPhone,Business Insider,16 hours ago,This story is available exclusively to Business Insider subscribers. Become an Insider and start...,https://www.businessinsider.com/tween-made-presentation-convince-parents-smartphone-2024-6
Bigger and brighter: iPhone 16 & iPhone 16 Pro rumored screen changes - iPhone Discussions on...,AppleInsider,5 days ago,The iPhone 16 and iPhone 16 Pro are expected to get some display changes. Despite Apple's generally...,https://forums.appleinsider.com/discussion/236560/bigger-and-brighter-iphone-16-iphone-16-pro-rumored-screen-changes
"Apple Brings Back iPhone 14 Pro For First Time—At Lower Price, Refurbished",Forbes,6 days ago,Apple has a clear policy for its Pro iPhone models: they’re on sale for a year and then retired when...,http://www.forbes.com/sites/davidphelan/2024/05/29/apple-brings-back-iphone-14-pro-for-first-time-in-unusual-move/
Apple's iPhone 16 Pro could have world's thinnest bezels,AppleInsider,16 hours ago,A new leak about the iPhone 16 Pro goes further than previous claims about the bezels and says they...,https://appleinsider.com/articles/24/06/03/apples-iphone-16-pro-could-have-worlds-thinnest-bezels
"'Hey Siri, can you...?': 3 ways AI on iPhone will change Apple's voice assistant forever",LaptopMag via Yahoo News,13 hours ago,"Using siri on iphone. Siri, Apple's now iconic virtual voice assistant, originally launched as a...",https://www.yahoo.com/tech/hey-siri-3-ways-ai-140000691.html
iPhone 16 Pro Models Might Come With Thinner Bezels Than Galaxy S24,Gadgets 360,17 hours ago,Apple is expected to bring significant display improvements to the iPhone 16 series. As per a new...,https://www.gadgets360.com/mobiles/news/iphone-16-pro-max-display-bezel-1-15-mm-apple-leaks-weibo-5805364
Your iPhone's Apple Cash Now Has Virtual Card Numbers. Here's How to Use Them,CNET,16 hours ago,"Apple released iOS 17.5 in May, and the update brought new features to your iPhone, like the ability...",https://www.cnet.com/tech/services-and-software/your-iphones-apple-cash-now-has-virtual-card-numbers-heres-how-to-use-them/
iPhone 16 Destined To Have The World's Thinest Bezels? New Leak Reveals It Could Outshine Current...,Benzinga,23 hours ago,"Apple Inc.’s AAPL upcoming iPhone 16 Pro is expected to boast the world’s thinnest bezels,...",https://www.benzinga.com/news/24/06/39129016/iphone-16-destined-to-have-the-worlds-thinest-bezels-new-leak-reveals-it-could-outshine-current-reco
Here's the pitch deck my tween made me to get an iPhone,INSIDER via Yahoo News,16 hours ago,The author's daughter made a presentation to convince her to buy her an iPhone.Westend61/Getty...,https://www.yahoo.com/news/heres-pitch-deck-tween-made-101301303.html?fr=sycsrp_catchall
Something important just happened to the iPhone 16 series,Digital Trends via Yahoo News,6 days ago,"iPhone 16 Pro and iPhone 16 Pro Max renders MacRumors With the calendar about to turn to June,...",https://www.yahoo.com/tech/something-important-just-happened-iphone-164935852.html
The best feature of Apple's foldable iPhone might have nothing to do with the screen,BGR,10 hours ago,A recent wave of rumors claims that Apple will release a foldable MacBook before a foldable iPhone....,https://bgr.com/tech/the-best-feature-of-apples-foldable-iphone-might-have-nothing-to-do-with-the-screen/
I swapped my iPhone 15 Pro for an iPhone 15 – and it was a big mistake,TechRadar,3 days ago,"Don't get me wrong, the iPhone 15 is an extremely solid phone. In recent years, Apple's standard...",https://www.techradar.com/phones/iphone/i-swapped-my-iphone-15-pro-for-an-iphone-15-and-it-was-a-big-mistake
The iPhone AI feature I want most from iOS 18 might not be coming until 2025,BGR,16 hours ago,"Apple is one week away from unveiling the AI future of its products, with the iPhone and iOS 18 at...",https://bgr.com/tech/the-iphone-ai-feature-i-want-most-from-ios-18-might-not-be-coming-until-2025/
How to Stop iPhone Verification When Installing Free Apps,MakeUseOf,14 hours ago,"Seeing the ""Verification Required"" prompt every time you want to install an app from the App Store...",https://www.makeuseof.com/stop-iphone-verification-install-free-apps/
Daisy recycling robot now smashes iPhones for speed - iPhone Discussions on AppleInsider Forums,AppleInsider,12 hours ago,"Apple has shown off its Daisy robot for recycling iPhones before, but now it's become much faster by...",https://forums.appleinsider.com/discussion/236589/daisy-recycling-robot-now-smashes-iphones-for-speed
"Foldable iPhone unlikely before 2027, says TrendForce; crease issue is key - 9to5Mac",9to5Mac,14 hours ago,"A report last month suggested that we might see the first foldable iPhone in 2026, but market...",https://9to5mac.com/2024/06/03/foldable-iphone-unlikely-before-2027/
The latest leak gives us an interesting detail about the iPhone 16 Pro's screen bezels,Neowin,20 hours ago,"A leaker allegedly got his hands on the upcoming iPhone 16 Pro and the iPhone 16 Pro Max displays and measured the bezels, revealing that both phones will have more display and come with thin bezels.",https://www.neowin.net/news/the-latest-leak-gives-us-an-interesting-detail-about-the-iphone-16-pros-screen-bezels/
Foldable iPhone Unlikely to Launch Before 2027,MacRumors,14 hours ago,"Apple is unlikely to release a foldable iPhone before 2027, but it could significantly disrupt the market when it launches, according to Taiwanese...",https://www.macrumors.com/2024/06/03/foldable-iphone-unlikely-to-launch-before-2027/
K-9 helps find stolen phone with insulin monitor on it,WSOC via Yahoo News,8 hours ago,"“Find my iPhone” can come in handy when your phone is missing, but a K-9 in Union County saved the...",https://www.yahoo.com/news/k-9-helps-stolen-phone-182954526.html?fr=sycsrp_catchall
Folium is the first emulator to bring Nintendo 3DS games to your Apple iPhone,Neowin,14 hours ago,"After a bunch of emulators, Folium is the latest to join the crew which is also the first emulator to bring Nintendo 3DS games to an Apple iPhone. It is available for a one-time fee of $4.99.",https://www.neowin.net/news/folium-is-the-first-emulator-to-bring-nintendo-3ds-games-to-your-apple-iphone/
UBS: iPhone sell-through down YoY during April By Investing.com,Investing.com,5 days ago,"In a note Thursday, UBS analysts said iPhone sell-through declined year over year in April, with...",https://uk.investing.com/news/stock-market-news/ubs-iphone-sellthrough-down-yoy-during-april-432SI-3523254
"Apple Loop: iPhone 16 Pro Details, iOS 18’s AI Plans, iPhone 14 Pro Special Offer",Forbes,2 days ago,"This week’s Apple headlines:iPhone 16 Pro specs, iOS 18 details, Apple’s AI marketing plans, an OLED...",http://www.forbes.com/sites/ewanspence/2024/06/02/apple-news-headlines-iphone-16-pro-ios-18-ai-ipad-pro-logo-macbook-pro-oled/
"Best prepaid phone deals: Android, iPhone, flip phone",Digital Trends via Yahoo News,9 hours ago,"Read onward for more of those details, and if you’d like to see some other affordable phone options...",https://www.yahoo.com/tech/best-prepaid-phone-deals-android-182630224.html
Don’t expect a folding iPhone anytime soon,Digital Trends via Yahoo News,10 hours ago,"It might be a lot larger before we see the first foldable iPhone. While previous rumors suggested one was coming next year, that may no longer be the...",https://www.yahoo.com/tech/don-t-expect-folding-iphone-162344479.html
Google is making it easier to ditch your iPhone for an Android phone,Digital Trends via Yahoo News,9 hours ago,"Prakhar Khanna / Digital Trends Switching phones is never a smooth process, even if you’re switching...",https://www.yahoo.com/tech/google-making-easier-ditch-iphone-173819509.html
Did you own an iPhone? You may be owed money. Here's how to submit a settlement claim,The Arizona Republic,4 days ago,Owners of the iPhone 7 and iPhone 7 Plus may be eligible for a payout as part of a $35 million...,https://www.azcentral.com/story/money/business/consumers/2024/05/31/iphone-7-settlement/73913774007/
iPhone users running out of time to claim settlement,Newsweek,5 days ago,Apple users should act quickly because they will soon run out of time to claim an iPhone settlement worth more than $300. The company will pay up to $349...,https://www.newsweek.com/iphone-users-running-out-time-claim-settlement-1906025
iPhone 16 Pro Set to Feature Thinnest Bezels Ever Seen on a Phone,The Mac Observer,15 hours ago,"Apple’s upcoming iPhone 16 Pro models are set to feature the thinnest bezels ever seen on a smartphone. According to multiple sources, including leaker Ice Universe, the bezels ...",https://www.macobserver.com/news/iphone-16-pro-set-to-feature-thinnest-bezels-ever-seen-on-a-phone/
"iPhone 16 Pro, iPhone 16 Pro Max Could Feature Up To 40 Percent Smaller Bezels Compared To iPhone 15...",Wccftech,1 day ago,"The iPhone 15 Pro and iPhone 15 Pro Max had shockingly thin bezels, but Apple is rumored to go the extra mile with the iPhone 16 Pro ...",https://wccftech.com/iphone-16-pro-max-up-to-40-percent-smaller-bezels/
iOS 18 Rumored to Add These 6 New Features to iPhone's Messages App,MacRumors,16 hours ago,"Apple is expected to announce iOS 18 in one week from now, and the update is rumored to include many...",https://www.macrumors.com/2024/06/03/ios-18-rumored-features-for-messages-app/
The best VPN for iPhone: Which iOS VPN should you pick?,Mashable,10 hours ago,"Commitment-phobes hunting for a premium VPN app should look into ExpressVPN, which offers a...",https://mashable.com/roundup/best-vpn-for-iphone
iPhone 16 Pro Could Break Record for Thinnest Bezels on a Smartphone,MacRumors,21 hours ago,"Apple's upcoming iPhone 16 Pro models will have the thinnest bezels of any smartphone, beating the...",https://www.macrumors.com/2024/06/03/iphone-16-pro-thinnest-bezels-smartphone/
iOS 18: Six new features coming to iPhone - 9to5Mac,9to5Mac,11 hours ago,"While new AI features will steal the show at WWDC next week, Apple has a number of other changes planned for iOS 18. This includes new home screen...",https://9to5mac.com/2024/06/03/ios-18-new-features-iphone-ai/
Leaker who got their hands on iPhone 16 Pro's screen has an exciting detail to share,PhoneArena,1 day ago,"I am having a hard time believing rumors that the iPhone 16 Pro will not be a significant upgrade over the iPhone 15 Pro. First off, the screen size for ...",https://www.phonearena.com/news/Leaker-who-got-their-hands-on-iPhone-16-Pros-screen-has-an-exciting-detail-to-share_id158960
How to play 'Fortnite' on iPhone,Mashable,4 days ago,Playing Fortnite on your iPhone is difficult these days considering the game isn't available on the Apple App Store anymore. Due to legal issues between...,https://mashable.com/article/how-to-play-fortnite-without-app-store-iphone
Crime blotter: California Apple Store theft suspects in court - iPhone Discussions on AppleInsider...,AppleInsider,24 hours ago,"In this week's roundup of Apple-related crime, a Man who burned down home over iPhone...",https://forums.appleinsider.com/discussion/236584/crime-blotter-california-apple-store-theft-suspects-in-court
Want to play Nintendo 3DS games on your iPhone? The first emulator has just landed on iOS,TechRadar,17 hours ago,"Apple opened up the iOS App Store to game console emulators back in April, and since then we've seen...",https://www.techradar.com/phones/iphone/want-to-play-nintendo-3ds-games-on-your-iphone-the-first-emulator-has-just-landed-on-ios
Apple allegedly preparing to overhaul the iPhone Control Center as a part of iOS 18,Neowin,22 hours ago,"Apart from a slew of artificial intelligence features, iOS 18 is reportedly expected to bring some...",https://www.neowin.net/news/apple-allegedly-preparing-to-overhaul-the-iphone-control-center-as-a-part-of-ios-18/
Brightness Changes in Apple iPhone 16 Series Set to Redefine Display Quality,Inferse.com,2 days ago,Apple is set to introduce significant changes in the brightness capabilities of its upcoming iPhone...,https://inferse.com/856217/brightness-changes-in-apple-iphone-16-series-set-to-redefine-display-quality/
Apple's big summer event is one week away. Here's what the iPhone company is expected to announce.,Business Insider,9 hours ago,"Apple is expected to reveal iOS 18, an updated Siri, and potentially a partnership with OpenAI.",https://www.businessinsider.com/apples-wwdc-2024-expect-ai-news-siri-updates-new-homes-screen-more-2024-6
"The multi-device, fast-switching Logitech K480 is just $30 right now",Macworld,14 hours ago,"Stashing your iPhone, iPad, and the Logitech K480 in your bag can be just enough for a full and...",https://www.macworld.com/article/2354538/the-multi-device-fast-switching-logitech-k480-is-just-30-right-now.html
Rumor: iPhone 16 Pro to feature world's thinnest smartphone bezel - 9to5Mac,9to5Mac,18 hours ago,"Although the iPhone 16 Pro will mostly resemble the design of the iPhone 15 Pro, we are expecting some small changes. The screen sizes of both the Pro and ...",https://9to5mac.com/2024/06/03/rumor-iphone-16-pro-world-thinnest-bezel/
"Girly Avocado Blossom Case for iPhone 12 Pro MAX, Now 90.05% Off",The Inventory,1 day ago,"The Girly Avocado Blossom Case for iPhone 12 Pro Max is more than just a phone case. Firstly, quality is a crucial factor when buying a phone case. This white iPhone ...",https://theinventory.com/girly-avocado-blossom-case-for-iphone-12-pro-max-now-9-1851514650
iPhone Won’t Turn On or Charge? Here is The Fix,The Harrisonburg Daily News-Record,6 days ago,"Many users find themselves asking, “Why will my iPhone not turn on?” or “Why is my iPhone not switching on?” Fortunately, Tenorshare CEO Mike Lee assures...",https://www.dnronline.com/associated_press/national/iphone-won-t-turn-on-or-charge-here-is-the-fix/article_6c27ed4e-5fdb-5fd3-8fd5-cfe2f54877b9.html
"If the iPhone 16 Pro ends up looking like the iPhone 15 Pro, will you buy it?",PhoneArena,6 days ago,"The iPhone 16 Pro is on the horizon, and as always, Apple fans are getting hyped. With each new ...",https://www.phonearena.com/news/if-the-iphone-16-pro-ends-up-looking-like-the-iphone-15-pro-will-you-buy-it_id158807
"Apple Brings Back iPhone 14 Pro For First Time—At Lower Price, Refurbished",Forbes,6 days ago,Apple has a clear policy for its Pro iPhone models: they’re on sale for a year and then retired when...,https://www.forbes.com/sites/davidphelan/2024/05/29/apple-brings-back-iphone-14-pro-for-first-time-in-unusual-move/
